{
    "1": {
        "question": "«أنزلَ من السماء ماءَ فأخرج به من الثّمرات رزقا لکم»:\n",
        "options": {
            "1": "آب را از آسمان نازل کرد و از میوه‌ها روزی برای شما قرار داد!",
            "2": "از آسمان آب را نازل کرد و از ثمره‌ها روزی برای شما بیرون آمد!",
            "3": "آبی از آسمان فرو فرستاد و به وسیلهٔ آن ثمره‌های رزق را برای شما خارج ساخت!",
            "4": "از آسمان آبی فرو فرستاد پس به وسیلهٔ آن از میوه‌ها رزقی را برای شما خارج ساخت!"
        },
        "final_answer": 4,
        "full_text": "«أنزلَ من السماء ماءَ فأخرج به من الثّمرات رزقا لکم»:\n\nOptions:\nA) آب را از آسمان نازل کرد و از میوه‌ها روزی برای شما قرار داد!\nB) از آسمان آب را نازل کرد و از ثمره‌ها روزی برای شما بیرون آمد!\nC) آبی از آسمان فرو فرستاد و به وسیلهٔ آن ثمره‌های رزق را برای شما خارج ساخت!\nD) از آسمان آبی فرو فرستاد پس به وسیلهٔ آن از میوه‌ها رزقی را برای شما خارج ساخت!",
        "metadata": {
            "image": false,
            "course": "arabic",
            "year": "1399",
            "month": "tir",
            "question_number": "1"
        }
    },
    "2": {
        "question": "«لا تَعِش فی الماضی و ما وقع فیه حتی لا یُضیّع مستقبلُک!»:\n",
        "options": {
            "1": "در گذشته و آنچه در آن رخ داده است زندگی مکن تا آینده‌ات تباه نشود!",
            "2": "در گذشته‌ها و چیزهایی که در آن‌ها رخ داده بود زندگی مکن تا آیندهٔ تو ضایع نگردد!",
            "3": "برای اینکه آیندهٔ خود را تباه نسازی، در گذشته و آنچه در آن روی داد، زندگی مکن!",
            "4": "برای تباه نساختن آیندهٔ‌ خویش،‌ در گذشته و چیزی که در آن واقع میشود، زندگی منمای!"
        },
        "final_answer": 1,
        "full_text": "«لا تَعِش فی الماضی و ما وقع فیه حتی لا یُضیّع مستقبلُک!»:\n\nOptions:\nA) در گذشته و آنچه در آن رخ داده است زندگی مکن تا آینده‌ات تباه نشود!\nB) در گذشته‌ها و چیزهایی که در آن‌ها رخ داده بود زندگی مکن تا آیندهٔ تو ضایع نگردد!\nC) برای اینکه آیندهٔ خود را تباه نسازی، در گذشته و آنچه در آن روی داد، زندگی مکن!\nD) برای تباه نساختن آیندهٔ‌ خویش،‌ در گذشته و چیزی که در آن واقع میشود، زندگی منمای!",
        "metadata": {
            "image": false,
            "course": "arabic",
            "year": "1399",
            "month": "tir",
            "question_number": "2"
        }
    },
    "3": {
        "question": "«هناک لا إنسانَ بدون خطأ، ولکنّه یفشل عندما یَعدَ نفسَه عالما یَعرفُ کلَّ شیء!»:\n",
        "options": {
            "1": "هیچ انسانی نیست که خطا نکند، ولی هنگامی که خود را دانای همه چیز بشمار آورد، شکست خواهد خورد!",
            "2": "انسان بدون اشتباه، هیچگاه وجود ندارد، اما او می‌بازد هرگاه خود را دانایی فرض کند که هر چیزی را می‌دانسته است!",
            "3": "هیچ انسانی بدون خطا وجود ندارد، ولی زمانی که خودش را عالمی بشمار آورد که همه چیز را می‌داند، شکست می‌خورد!",
            "4": "انسان هیچگاه بدون اشتباه نیست، اما زمانی می‌بازد که نفس خود را عالمی به حساب آورد که بر هر چیزی آگاه است!"
        },
        "final_answer": 3,
        "full_text": "«هناک لا إنسانَ بدون خطأ، ولکنّه یفشل عندما یَعدَ نفسَه عالما یَعرفُ کلَّ شیء!»:\n\nOptions:\nA) هیچ انسانی نیست که خطا نکند، ولی هنگامی که خود را دانای همه چیز بشمار آورد، شکست خواهد خورد!\nB) انسان بدون اشتباه، هیچگاه وجود ندارد، اما او می‌بازد هرگاه خود را دانایی فرض کند که هر چیزی را می‌دانسته است!\nC) هیچ انسانی بدون خطا وجود ندارد، ولی زمانی که خودش را عالمی بشمار آورد که همه چیز را می‌داند، شکست می‌خورد!\nD) انسان هیچگاه بدون اشتباه نیست، اما زمانی می‌بازد که نفس خود را عالمی به حساب آورد که بر هر چیزی آگاه است!",
        "metadata": {
            "image": false,
            "course": "arabic",
            "year": "1399",
            "month": "tir",
            "question_number": "3"
        }
    },
    "4": {
        "question": "«کان ذلک العالمُ یُمضی أوقاتَه بالمطالعة و الدراسة و لا یبتعد عن النّشاط لحظة علی رغم الظّروف القاسیة!»:\n",
        "options": {
            "1": "تمام وقت آن عالم در مطالعه و پژوهش می‌گذشت، و با وجود شرایط سخت یک لحظه از فعالیت دور نمی‌شد!",
            "2": "آن دانشمند اوقات خود را به مطالعه و تحقیق می‌گذراند و با وجود شرایط سخت، لحظه‌ای از فعالیت دور نمی‌شد!",
            "3": "وقت آن دانشمند به مطالعه و تحقیق می‌گذشت، درحالی‌که علی‌رغم شرایط سخت لحظه‌ای از کار دور نمی‌شود!",
            "4": "آن عالم اوقاتش را در مطالعه و پژوهش می‌گذراند، درحالی‌که علی‌رغم شرایط سختش حتی یک لحظه از کار دور نمی‌شود!"
        },
        "final_answer": 2,
        "full_text": "«کان ذلک العالمُ یُمضی أوقاتَه بالمطالعة و الدراسة و لا یبتعد عن النّشاط لحظة علی رغم الظّروف القاسیة!»:\n\nOptions:\nA) تمام وقت آن عالم در مطالعه و پژوهش می‌گذشت، و با وجود شرایط سخت یک لحظه از فعالیت دور نمی‌شد!\nB) آن دانشمند اوقات خود را به مطالعه و تحقیق می‌گذراند و با وجود شرایط سخت، لحظه‌ای از فعالیت دور نمی‌شد!\nC) وقت آن دانشمند به مطالعه و تحقیق می‌گذشت، درحالی‌که علی‌رغم شرایط سخت لحظه‌ای از کار دور نمی‌شود!\nD) آن عالم اوقاتش را در مطالعه و پژوهش می‌گذراند، درحالی‌که علی‌رغم شرایط سختش حتی یک لحظه از کار دور نمی‌شود!",
        "metadata": {
            "image": false,
            "course": "arabic",
            "year": "1399",
            "month": "tir",
            "question_number": "4"
        }
    },
    "5": {
        "question": "«کاد المعلّمُ یبدأ تدریسه أذ دخل الصفَّ أحدُ الطّلابِ و قطع کلامَ المعلّم و هو خَجِلُ من تأخُره!»:\n",
        "options": {
            "1": "معلم تدریسش را شروع می‌کرد که یکی از دانش‌آموزان با شرمندگی از تأخیر خود، وارد کلاس شد و سخن معلم را برید!",
            "2": "نزدیک بود معلم درس خویش را آغاز کند که دانش‌آموزی ناگهان داخل کلاس شد و کلام معلم را با خجالت از دیر کردنش قطع نمود!",
            "3": "نزدیک بود معلم درس خود را آغاز نماید زمانی که یک دانش‌‌آموز به کلاس داخل شد و سخن معلم را برید و او از تأخیر خویش شرمنده شد!",
            "4": "معلم تدریس خود را داشت شروع می‌کرد، که ناگهان یکی از دانش‌آموزان وارد کلاس شد و درحالی‌که از تأخیر خود شرمنده بود سخن معلم را قطع کرد!"
        },
        "final_answer": 4,
        "full_text": "«کاد المعلّمُ یبدأ تدریسه أذ دخل الصفَّ أحدُ الطّلابِ و قطع کلامَ المعلّم و هو خَجِلُ من تأخُره!»:\n\nOptions:\nA) معلم تدریسش را شروع می‌کرد که یکی از دانش‌آموزان با شرمندگی از تأخیر خود، وارد کلاس شد و سخن معلم را برید!\nB) نزدیک بود معلم درس خویش را آغاز کند که دانش‌آموزی ناگهان داخل کلاس شد و کلام معلم را با خجالت از دیر کردنش قطع نمود!\nC) نزدیک بود معلم درس خود را آغاز نماید زمانی که یک دانش‌‌آموز به کلاس داخل شد و سخن معلم را برید و او از تأخیر خویش شرمنده شد!\nD) معلم تدریس خود را داشت شروع می‌کرد، که ناگهان یکی از دانش‌آموزان وارد کلاس شد و درحالی‌که از تأخیر خود شرمنده بود سخن معلم را قطع کرد!",
        "metadata": {
            "image": false,
            "course": "arabic",
            "year": "1399",
            "month": "tir",
            "question_number": "5"
        }
    },
    "6": {
        "question": "«قَرّرتُ مع اُختی الصُغری أن نذهب غدّا رأس الساعة التاسعة و التاسعة و النّصف إلی المتحف لمشاهدة الأثار التاریخیّة!»:\n",
        "options": {
            "1": "با خواهر کوچکم قرار گذاشتیم فردا سر ساعت نه و نیم برای بازدید از آثار باستانی به موزه برویم!",
            "2": "من با خواهر کوچکترم قرار گذاشتیم؛ سر ساعت نه و نیم فردا به دیدار آثار باستانی موزه‌ها برویم!",
            "3": "من و خواهرم صغری قرار گذاشتیم رأس ساعت نه و نیم فردا به مشاهدهٔ آثار تاریخی موزه‌ها برویم!",
            "4": "با خواهر کوچکترم قرار گذاشتم که فردا رأس ساعت نه و نیم برای مشاهدهٔ آثار تاریخی به موزه برویم!"
        },
        "final_answer": 4,
        "full_text": "«قَرّرتُ مع اُختی الصُغری أن نذهب غدّا رأس الساعة التاسعة و التاسعة و النّصف إلی المتحف لمشاهدة الأثار التاریخیّة!»:\n\nOptions:\nA) با خواهر کوچکم قرار گذاشتیم فردا سر ساعت نه و نیم برای بازدید از آثار باستانی به موزه برویم!\nB) من با خواهر کوچکترم قرار گذاشتیم؛ سر ساعت نه و نیم فردا به دیدار آثار باستانی موزه‌ها برویم!\nC) من و خواهرم صغری قرار گذاشتیم رأس ساعت نه و نیم فردا به مشاهدهٔ آثار تاریخی موزه‌ها برویم!\nD) با خواهر کوچکترم قرار گذاشتم که فردا رأس ساعت نه و نیم برای مشاهدهٔ آثار تاریخی به موزه برویم!",
        "metadata": {
            "image": false,
            "course": "arabic",
            "year": "1399",
            "month": "tir",
            "question_number": "6"
        }
    },
    "7": {
        "question": "«عامل النّاس مثلَما تُحبُّ أن یُعاملوک، و لا تَکن ذا وجهین!»:\n",
        "options": {
            "1": "با مردم آن‌طور رفتار کن که دوست داری با تو رفتار کنند، و دو رو مباش!",
            "2": "طوری با مردمان معامله نمای که دوست داری با تو دادوستد شود، پس دو چهره نباش!",
            "3": "با مردم همانظور معامله کنید که دوست داشته‌اید با شما عمل کنند، پس از دورویان نباشید!",
            "4": "به گونه‌ای با مردم رفتار کنید که دوست می‌دارید با شما رفتار شود، و دارای دو چهره مباشید!"
        },
        "final_answer": 1,
        "full_text": "«عامل النّاس مثلَما تُحبُّ أن یُعاملوک، و لا تَکن ذا وجهین!»:\n\nOptions:\nA) با مردم آن‌طور رفتار کن که دوست داری با تو رفتار کنند، و دو رو مباش!\nB) طوری با مردمان معامله نمای که دوست داری با تو دادوستد شود، پس دو چهره نباش!\nC) با مردم همانظور معامله کنید که دوست داشته‌اید با شما عمل کنند، پس از دورویان نباشید!\nD) به گونه‌ای با مردم رفتار کنید که دوست می‌دارید با شما رفتار شود، و دارای دو چهره مباشید!",
        "metadata": {
            "image": false,
            "course": "arabic",
            "year": "1399",
            "month": "tir",
            "question_number": "7"
        }
    },
    "8": {
        "question": "عیّن الصحیح:\n",
        "options": {
            "1": "إنّنا محتاجون إلی تجارب المتقاعدین لتقدّمنا: ما به تجربهٔ بازنشستگان نیازمندیم تا پیشرفت کنیم!",
            "2": "إن کان المتفرّجون فی الملعب، یُشجَّع اللاعبون: اگر تماشاچیان در ورزشگاه باشند بازیکنان را تشویق می‌کنند!",
            "3": "قد تَبدا آلافُ الصعوبات بعد لحظة إهمالٍ: گاهی بعد از یک لحظه سهل‌انگاری هزاران مشکل شروع می‌شود!",
            "4": "مَن یَتجسّس فی أعمال الآخَرین فلا أمنَ و لا راحةَ له: کسی که در مورد دیگران جاسوسی کند امنیت و راحتی ندارد!"
        },
        "final_answer": 3,
        "full_text": "عیّن الصحیح:\n\nOptions:\nA) إنّنا محتاجون إلی تجارب المتقاعدین لتقدّمنا: ما به تجربهٔ بازنشستگان نیازمندیم تا پیشرفت کنیم!\nB) إن کان المتفرّجون فی الملعب، یُشجَّع اللاعبون: اگر تماشاچیان در ورزشگاه باشند بازیکنان را تشویق می‌کنند!\nC) قد تَبدا آلافُ الصعوبات بعد لحظة إهمالٍ: گاهی بعد از یک لحظه سهل‌انگاری هزاران مشکل شروع می‌شود!\nD) مَن یَتجسّس فی أعمال الآخَرین فلا أمنَ و لا راحةَ له: کسی که در مورد دیگران جاسوسی کند امنیت و راحتی ندارد!",
        "metadata": {
            "image": false,
            "course": "arabic",
            "year": "1399",
            "month": "tir",
            "question_number": "8"
        }
    },
    "9": {
        "question": "عیّن الصّحیح:\n",
        "options": {
            "1": "أفضلُ سلاحِ المرء کلامُه و کأنّه حسامُ: بهترین سلاح انسان کلامی است که چون شمشیر می‌باشد!",
            "2": "عینُ البومة ثابتة و هی لا تقدر أن تدیر إلّا رأسها: چشم جغد ثابت است و فقط سر آن حرکت می‌کند!",
            "3": "هناک عُشّ صغیر فوق تلک الشجرة المرتفعة لا فرخَ فیه: بالای آن درخت بلند آشیانهٔ کوچکی هست که هیچ جوجه‌ای در آن نیست!",
            "4": "طُلب من الطلّاب أن یأتوا بوالدیهم یوم الخمیس إلی المدرسة: از دانش‌آموزان خواست که روز پنج‌شنبه با والدین خود به مدرسه بیایند!"
        },
        "final_answer": 3,
        "full_text": "عیّن الصّحیح:\n\nOptions:\nA) أفضلُ سلاحِ المرء کلامُه و کأنّه حسامُ: بهترین سلاح انسان کلامی است که چون شمشیر می‌باشد!\nB) عینُ البومة ثابتة و هی لا تقدر أن تدیر إلّا رأسها: چشم جغد ثابت است و فقط سر آن حرکت می‌کند!\nC) هناک عُشّ صغیر فوق تلک الشجرة المرتفعة لا فرخَ فیه: بالای آن درخت بلند آشیانهٔ کوچکی هست که هیچ جوجه‌ای در آن نیست!\nD) طُلب من الطلّاب أن یأتوا بوالدیهم یوم الخمیس إلی المدرسة: از دانش‌آموزان خواست که روز پنج‌شنبه با والدین خود به مدرسه بیایند!",
        "metadata": {
            "image": false,
            "course": "arabic",
            "year": "1399",
            "month": "tir",
            "question_number": "9"
        }
    },
    "10": {
        "question": "«امروز کتابی خریدم که قبلاً آن را دیده بودم!»:\n",
        "options": {
            "1": "هذا یوم اشتریت الکتاب و رأیت قبل هذا!",
            "2": "اشتریت الیوم کتابًا قد رأیته من قبل!",
            "3": "هذا الیوم اشتریت کتابًا رأیت قبل هذا!",
            "4": "قد اشتریت الیوم الکتاب و رأیته من قبل!"
        },
        "final_answer": 2,
        "full_text": "«امروز کتابی خریدم که قبلاً آن را دیده بودم!»:\n\nOptions:\nA) هذا یوم اشتریت الکتاب و رأیت قبل هذا!\nB) اشتریت الیوم کتابًا قد رأیته من قبل!\nC) هذا الیوم اشتریت کتابًا رأیت قبل هذا!\nD) قد اشتریت الیوم الکتاب و رأیته من قبل!",
        "metadata": {
            "image": false,
            "course": "arabic",
            "year": "1399",
            "month": "tir",
            "question_number": "10"
        }
    },
    "11": {
        "question": "اِقرأ النّص التّالی ثمّ أجب عن الأسئلة بما یناسب النصّ:\nالعلمُ یُحیی فی الإنسان اُمورًا مختلفة، منها الشّعور بالاعتماد علی النُفس، فمَن اتّخذه رفیقًا فی طریقة فی الحیاة یری أنّه لا یَقدر أن یَعیش غافلاً عَمّا یَجری حولَه، بل یَسعی للحصول علی غایة یَرسَمها لنفسه. لِنَنظرً إلی حیاة العلماء فی التاریخ، فهم لَم یَستطیعوا أن یعیشوا لأنفسهم فقط لأنّهم رأو غایةْ عُلیا فی الحیاة و حاولوا أن یَصلوا إلیها و کذلک قاموا بدعوة الآخرین إلیها أیضًا!\nأنّ العلم یَبنی حصارًا یُحافظ علی کلّ مَن یختاره من الوقوع فی الخطایا و یَمنعه من ارتکاب الجرائمِ و التبعیّة الخاطئة؛ ولکن هیهات هیهات من الاعتماد علی العلم أکثر من طاقته، فإنّه یُهیّی للمجتمع طرقَ التقدّم و یُحقّق له ارتقاءَ شاملاً یضمن مُستقبلاً مُضیئًا؛ ولکنّ المهمٌ فی هذا الأمر هو أنّ العلم بوحده لا یُحقِّق هذه الغایات الجمیلةَ بل بحاجة إلی رفیق آخر و هو «الإیمان»!\n* لماذا لا تُصبح الغفلةُ ملازِمة العالم؟ عیّن الصّحیح: الأنّ ...\n",
        "options": {
            "1": "رفیقه الآخر و هو الإیمان یمنعه من هذا الأمر!",
            "2": "التقدّم و المستقبل المضیء لا یَسمحان بذلک!",
            "3": "الاعتماد علی النّفس هو السبب لمنع ذلک!",
            "4": "اتّخاذ الغایة فی الحیاة یَمنعه من ذلک!"
        },
        "final_answer": 4,
        "full_text": "اِقرأ النّص التّالی ثمّ أجب عن الأسئلة بما یناسب النصّ:\nالعلمُ یُحیی فی الإنسان اُمورًا مختلفة، منها الشّعور بالاعتماد علی النُفس، فمَن اتّخذه رفیقًا فی طریقة فی الحیاة یری أنّه لا یَقدر أن یَعیش غافلاً عَمّا یَجری حولَه، بل یَسعی للحصول علی غایة یَرسَمها لنفسه. لِنَنظرً إلی حیاة العلماء فی التاریخ، فهم لَم یَستطیعوا أن یعیشوا لأنفسهم فقط لأنّهم رأو غایةْ عُلیا فی الحیاة و حاولوا أن یَصلوا إلیها و کذلک قاموا بدعوة الآخرین إلیها أیضًا!\nأنّ العلم یَبنی حصارًا یُحافظ علی کلّ مَن یختاره من الوقوع فی الخطایا و یَمنعه من ارتکاب الجرائمِ و التبعیّة الخاطئة؛ ولکن هیهات هیهات من الاعتماد علی العلم أکثر من طاقته، فإنّه یُهیّی للمجتمع طرقَ التقدّم و یُحقّق له ارتقاءَ شاملاً یضمن مُستقبلاً مُضیئًا؛ ولکنّ المهمٌ فی هذا الأمر هو أنّ العلم بوحده لا یُحقِّق هذه الغایات الجمیلةَ بل بحاجة إلی رفیق آخر و هو «الإیمان»!\n* لماذا لا تُصبح الغفلةُ ملازِمة العالم؟ عیّن الصّحیح: الأنّ ...\n\nOptions:\nA) رفیقه الآخر و هو الإیمان یمنعه من هذا الأمر!\nB) التقدّم و المستقبل المضیء لا یَسمحان بذلک!\nC) الاعتماد علی النّفس هو السبب لمنع ذلک!\nD) اتّخاذ الغایة فی الحیاة یَمنعه من ذلک!",
        "metadata": {
            "image": false,
            "course": "arabic",
            "year": "1399",
            "month": "tir",
            "question_number": "11"
        }
    },
    "12": {
        "question": "عیّن الصّحیح حسب النصّ:\n",
        "options": {
            "1": "مفتاح التقدّم الحقیقی هو اکتساب العلم وحیدًا!",
            "2": "مِن أخطر الاُمور هو تحمیل العلم أکثر من طاقته!",
            "3": "إنّ الغایة الوحیدة الّتی یَرسمها العلماءُ هی الاعتماد علی النفس!",
            "4": "العلم من دون مساعدٍ آخر یحافظ علی الجمهور من الخطایا و الزّلل!"
        },
        "final_answer": 2,
        "full_text": "اِقرأ النّص التّالی ثمّ أجب عن الأسئلة بما یناسب النصّ:\nالعلمُ یُحیی فی الإنسان اُمورًا مختلفة، منها الشّعور بالاعتماد علی النُفس، فمَن اتّخذه رفیقًا فی طریقة فی الحیاة یری أنّه لا یَقدر أن یَعیش غافلاً عَمّا یَجری حولَه، بل یَسعی للحصول علی غایة یَرسَمها لنفسه. لِنَنظرً إلی حیاة العلماء فی التاریخ، فهم لَم یَستطیعوا أن یعیشوا لأنفسهم فقط لأنّهم رأو غایةْ عُلیا فی الحیاة و حاولوا أن یَصلوا إلیها و کذلک قاموا بدعوة الآخرین إلیها أیضًا!\nأنّ العلم یَبنی حصارًا یُحافظ علی کلّ مَن یختاره من الوقوع فی الخطایا و یَمنعه من ارتکاب الجرائمِ و التبعیّة الخاطئة؛ ولکن هیهات هیهات من الاعتماد علی العلم أکثر من طاقته، فإنّه یُهیّی للمجتمع طرقَ التقدّم و یُحقّق له ارتقاءَ شاملاً یضمن مُستقبلاً مُضیئًا؛ ولکنّ المهمٌ فی هذا الأمر هو أنّ العلم بوحده لا یُحقِّق هذه الغایات الجمیلةَ بل بحاجة إلی رفیق آخر و هو «الإیمان»!\n*عیّن الصّحیح حسب النصّ:\n\nOptions:\nA) مفتاح التقدّم الحقیقی هو اکتساب العلم وحیدًا!\nB) مِن أخطر الاُمور هو تحمیل العلم أکثر من طاقته!\nC) إنّ الغایة الوحیدة الّتی یَرسمها العلماءُ هی الاعتماد علی النفس!\nD) العلم من دون مساعدٍ آخر یحافظ علی الجمهور من الخطایا و الزّلل!",
        "metadata": {
            "image": false,
            "course": "arabic",
            "year": "1399",
            "month": "tir",
            "question_number": "12"
        }
    },
    "13": {
        "question": "بم نحصل علی مستقبل مضیء لأبنائنا؟ عیّن الخطأ: بعلمٍ ...\n",
        "options": {
            "1": "یزیدهم أخلاقًا تُبعِّدهم عن السّلوکیات السّئة!",
            "2": "یُساعدهم علی اتّخاذ غایاتٍ رفیعةٍ فی الحیاة!",
            "3": "لا یُصاحبه أمرٌ آخر و هو الکفیل وحیدًا للتقدّم!",
            "4": "یحتاج إلی حصول جناح آخر للطّیران و هو الإیمان!"
        },
        "final_answer": 3,
        "full_text": "اِقرأ النّص التّالی ثمّ أجب عن الأسئلة بما یناسب النصّ:\nالعلمُ یُحیی فی الإنسان اُمورًا مختلفة، منها الشّعور بالاعتماد علی النُفس، فمَن اتّخذه رفیقًا فی طریقة فی الحیاة یری أنّه لا یَقدر أن یَعیش غافلاً عَمّا یَجری حولَه، بل یَسعی للحصول علی غایة یَرسَمها لنفسه. لِنَنظرً إلی حیاة العلماء فی التاریخ، فهم لَم یَستطیعوا أن یعیشوا لأنفسهم فقط لأنّهم رأو غایةْ عُلیا فی الحیاة و حاولوا أن یَصلوا إلیها و کذلک قاموا بدعوة الآخرین إلیها أیضًا!\nأنّ العلم یَبنی حصارًا یُحافظ علی کلّ مَن یختاره من الوقوع فی الخطایا و یَمنعه من ارتکاب الجرائمِ و التبعیّة الخاطئة؛ ولکن هیهات هیهات من الاعتماد علی العلم أکثر من طاقته، فإنّه یُهیّی للمجتمع طرقَ التقدّم و یُحقّق له ارتقاءَ شاملاً یضمن مُستقبلاً مُضیئًا؛ ولکنّ المهمٌ فی هذا الأمر هو أنّ العلم بوحده لا یُحقِّق هذه الغایات الجمیلةَ بل بحاجة إلی رفیق آخر و هو «الإیمان»!\n*بم نحصل علی مستقبل مضیء لأبنائنا؟ عیّن الخطأ: بعلمٍ ...\n\nOptions:\nA) یزیدهم أخلاقًا تُبعِّدهم عن السّلوکیات السّئة!\nB) یُساعدهم علی اتّخاذ غایاتٍ رفیعةٍ فی الحیاة!\nC) لا یُصاحبه أمرٌ آخر و هو الکفیل وحیدًا للتقدّم!\nD) یحتاج إلی حصول جناح آخر للطّیران و هو الإیمان!",
        "metadata": {
            "image": false,
            "course": "arabic",
            "year": "1399",
            "month": "tir",
            "question_number": "13"
        }
    },
    "14": {
        "question": "عیّن ما لا یناسب موضوع النصّ!\n",
        "options": {
            "1": "خرد باید و دانش و راستی / که کژّی بکوید در کاستی!",
            "2": "نکند هرگز اهل دانش و داد / دل مردم خراب و گنج آباد!",
            "3": "علمِ تنها، تو را به ره آرد!",
            "4": "علم اگر تنها بوَد رهزن بود!"
        },
        "final_answer": 3,
        "full_text": "اِقرأ النّص التّالی ثمّ أجب عن الأسئلة بما یناسب النصّ:\nالعلمُ یُحیی فی الإنسان اُمورًا مختلفة، منها الشّعور بالاعتماد علی النُفس، فمَن اتّخذه رفیقًا فی طریقة فی الحیاة یری أنّه لا یَقدر أن یَعیش غافلاً عَمّا یَجری حولَه، بل یَسعی للحصول علی غایة یَرسَمها لنفسه. لِنَنظرً إلی حیاة العلماء فی التاریخ، فهم لَم یَستطیعوا أن یعیشوا لأنفسهم فقط لأنّهم رأو غایةْ عُلیا فی الحیاة و حاولوا أن یَصلوا إلیها و کذلک قاموا بدعوة الآخرین إلیها أیضًا!\nأنّ العلم یَبنی حصارًا یُحافظ علی کلّ مَن یختاره من الوقوع فی الخطایا و یَمنعه من ارتکاب الجرائمِ و التبعیّة الخاطئة؛ ولکن هیهات هیهات من الاعتماد علی العلم أکثر من طاقته، فإنّه یُهیّی للمجتمع طرقَ التقدّم و یُحقّق له ارتقاءَ شاملاً یضمن مُستقبلاً مُضیئًا؛ ولکنّ المهمٌ فی هذا الأمر هو أنّ العلم بوحده لا یُحقِّق هذه الغایات الجمیلةَ بل بحاجة إلی رفیق آخر و هو «الإیمان»!\n*عیّن ما لا یناسب موضوع النصّ!\n\nOptions:\nA) خرد باید و دانش و راستی / که کژّی بکوید در کاستی!\nB) نکند هرگز اهل دانش و داد / دل مردم خراب و گنج آباد!\nC) علمِ تنها، تو را به ره آرد!\nD) علم اگر تنها بوَد رهزن بود!",
        "metadata": {
            "image": false,
            "course": "arabic",
            "year": "1399",
            "month": "tir",
            "question_number": "14"
        }
    },
    "15": {
        "question": "عیّن الصحیح فی الإعراب و التحلیل الصرفی«یَرسم»:\n",
        "options": {
            "1": "فعل مضارع - للغائب - ماضیه «رَسم» و کلُّ حروفه أصلیةٌ / فاعله «ها» و الجملة فعلیةٌ",
            "2": "للمذکّر الغائب - حروفه کلّها أصلیّة (=مجرّد ثلاثی) - معلوم / فعلٌ و مع فاعله جملةٌ فعلیة",
            "3": "للغائب - له ثلاثة حروف أصلیة و حرف واحد زائد (=مزید ثلاثی) / فعل و مع فاعله جملةٌ فعلیة",
            "4": "مضارع - لیس له حرفٌ زائد (=مجرد) - مجهول / مع فاعله جملةٌ‌ فعلیة، و ضمیر «ها» مفعول"
        },
        "final_answer": 2,
        "full_text": "اِقرأ النّص التّالی ثمّ أجب عن الأسئلة بما یناسب النصّ:\nالعلمُ یُحیی فی الإنسان اُمورًا مختلفة، منها الشّعور بالاعتماد علی النُفس، فمَن اتّخذه رفیقًا فی طریقة فی الحیاة یری أنّه لا یَقدر أن یَعیش غافلاً عَمّا یَجری حولَه، بل یَسعی للحصول علی غایة یَرسَمها لنفسه. لِنَنظرً إلی حیاة العلماء فی التاریخ، فهم لَم یَستطیعوا أن یعیشوا لأنفسهم فقط لأنّهم رأو غایةْ عُلیا فی الحیاة و حاولوا أن یَصلوا إلیها و کذلک قاموا بدعوة الآخرین إلیها أیضًا!\nأنّ العلم یَبنی حصارًا یُحافظ علی کلّ مَن یختاره من الوقوع فی الخطایا و یَمنعه من ارتکاب الجرائمِ و التبعیّة الخاطئة؛ ولکن هیهات هیهات من الاعتماد علی العلم أکثر من طاقته، فإنّه یُهیّی للمجتمع طرقَ التقدّم و یُحقّق له ارتقاءَ شاملاً یضمن مُستقبلاً مُضیئًا؛ ولکنّ المهمٌ فی هذا الأمر هو أنّ العلم بوحده لا یُحقِّق هذه الغایات الجمیلةَ بل بحاجة إلی رفیق آخر و هو «الإیمان»!\n*عیّن الصحیح فی الإعراب و التحلیل الصرفی«یَرسم»:\n\nOptions:\nA) فعل مضارع - للغائب - ماضیه «رَسم» و کلُّ حروفه أصلیةٌ / فاعله «ها» و الجملة فعلیةٌ\nB) للمذکّر الغائب - حروفه کلّها أصلیّة (=مجرّد ثلاثی) - معلوم / فعلٌ و مع فاعله جملةٌ فعلیة\nC) للغائب - له ثلاثة حروف أصلیة و حرف واحد زائد (=مزید ثلاثی) / فعل و مع فاعله جملةٌ فعلیة\nD) مضارع - لیس له حرفٌ زائد (=مجرد) - مجهول / مع فاعله جملةٌ‌ فعلیة، و ضمیر «ها» مفعول",
        "metadata": {
            "image": false,
            "course": "arabic",
            "year": "1399",
            "month": "tir",
            "question_number": "15"
        }
    },
    "16": {
        "question": "عیّن الصحیح فی الإعراب و التحلیل الصرفی «یُحافظ»:\n",
        "options": {
            "1": "مضارع - للمذکّر الغائب - ماضیه «حافظ» علی وزن «فاعل» / فعل و مع فاعله جملةٌ فعلیة",
            "2": "فعل مضارع - ماضیه «حافظ» من وزن «فاعل» و مصدره «حفظ» / الجملة فعلیة و وصفیة",
            "3": "للغائب - ماضیه «حافظ» و مصدره «محافظة» من باب «مفاعلة» - مجهول / مع فاعله جملةً فعلیة",
            "4": "للمفرد المذکّر الغائب - له حرفان زائدان (=مزید ثلاثی) / الجملة فعلیة و صفة للموصوف النکرة «حصارًا»"
        },
        "final_answer": 1,
        "full_text": "اِقرأ النّص التّالی ثمّ أجب عن الأسئلة بما یناسب النصّ:\nالعلمُ یُحیی فی الإنسان اُمورًا مختلفة، منها الشّعور بالاعتماد علی النُفس، فمَن اتّخذه رفیقًا فی طریقة فی الحیاة یری أنّه لا یَقدر أن یَعیش غافلاً عَمّا یَجری حولَه، بل یَسعی للحصول علی غایة یَرسَمها لنفسه. لِنَنظرً إلی حیاة العلماء فی التاریخ، فهم لَم یَستطیعوا أن یعیشوا لأنفسهم فقط لأنّهم رأو غایةْ عُلیا فی الحیاة و حاولوا أن یَصلوا إلیها و کذلک قاموا بدعوة الآخرین إلیها أیضًا!\nأنّ العلم یَبنی حصارًا یُحافظ علی کلّ مَن یختاره من الوقوع فی الخطایا و یَمنعه من ارتکاب الجرائمِ و التبعیّة الخاطئة؛ ولکن هیهات هیهات من الاعتماد علی العلم أکثر من طاقته، فإنّه یُهیّی للمجتمع طرقَ التقدّم و یُحقّق له ارتقاءَ شاملاً یضمن مُستقبلاً مُضیئًا؛ ولکنّ المهمٌ فی هذا الأمر هو أنّ العلم بوحده لا یُحقِّق هذه الغایات الجمیلةَ بل بحاجة إلی رفیق آخر و هو «الإیمان»!\n*عیّن الصحیح فی الإعراب و التحلیل الصرفی «یُحافظ»:\n\nOptions:\nA) مضارع - للمذکّر الغائب - ماضیه «حافظ» علی وزن «فاعل» / فعل و مع فاعله جملةٌ فعلیة\nB) فعل مضارع - ماضیه «حافظ» من وزن «فاعل» و مصدره «حفظ» / الجملة فعلیة و وصفیة\nC) للغائب - ماضیه «حافظ» و مصدره «محافظة» من باب «مفاعلة» - مجهول / مع فاعله جملةً فعلیة\nD) للمفرد المذکّر الغائب - له حرفان زائدان (=مزید ثلاثی) / الجملة فعلیة و صفة للموصوف النکرة «حصارًا»",
        "metadata": {
            "image": false,
            "course": "arabic",
            "year": "1399",
            "month": "tir",
            "question_number": "16"
        }
    },
    "17": {
        "question": "عیّن الصحیح فی الإعراب و التحلیل الصرفی «شاملاً»:\n",
        "options": {
            "1": "اسم - مفرد مذکّر - اسم فاعل (من فعل «شمل» المجرّد) / صفة للموصوف «ارتقاء»",
            "2": "مفرد مذکّر - اسم فاعل (فعله «شمل» بدون حرف زائد) - نکرة / صفة و موصوفه «یحقّق»",
            "3": "مفرد مذکر - معرفة - اسم فاعل (فعله «شمل» بدون حرف زائد) / صفة و موصوفه «ارتقاء»",
            "4": "اسم - اسم فاعل (مأخوذ من فعل «شامل» علی وزن «فاعل») / صفة أو نعت للموصوف النکرة"
        },
        "final_answer": 1,
        "full_text": "اِقرأ النّص التّالی ثمّ أجب عن الأسئلة بما یناسب النصّ:\nالعلمُ یُحیی فی الإنسان اُمورًا مختلفة، منها الشّعور بالاعتماد علی النُفس، فمَن اتّخذه رفیقًا فی طریقة فی الحیاة یری أنّه لا یَقدر أن یَعیش غافلاً عَمّا یَجری حولَه، بل یَسعی للحصول علی غایة یَرسَمها لنفسه. لِنَنظرً إلی حیاة العلماء فی التاریخ، فهم لَم یَستطیعوا أن یعیشوا لأنفسهم فقط لأنّهم رأو غایةْ عُلیا فی الحیاة و حاولوا أن یَصلوا إلیها و کذلک قاموا بدعوة الآخرین إلیها أیضًا!\nأنّ العلم یَبنی حصارًا یُحافظ علی کلّ مَن یختاره من الوقوع فی الخطایا و یَمنعه من ارتکاب الجرائمِ و التبعیّة الخاطئة؛ ولکن هیهات هیهات من الاعتماد علی العلم أکثر من طاقته، فإنّه یُهیّی للمجتمع طرقَ التقدّم و یُحقّق له ارتقاءَ شاملاً یضمن مُستقبلاً مُضیئًا؛ ولکنّ المهمٌ فی هذا الأمر هو أنّ العلم بوحده لا یُحقِّق هذه الغایات الجمیلةَ بل بحاجة إلی رفیق آخر و هو «الإیمان»!\n*عیّن الصحیح فی الإعراب و التحلیل الصرفی «شاملاً»:\n\nOptions:\nA) اسم - مفرد مذکّر - اسم فاعل (من فعل «شمل» المجرّد) / صفة للموصوف «ارتقاء»\nB) مفرد مذکّر - اسم فاعل (فعله «شمل» بدون حرف زائد) - نکرة / صفة و موصوفه «یحقّق»\nC) مفرد مذکر - معرفة - اسم فاعل (فعله «شمل» بدون حرف زائد) / صفة و موصوفه «ارتقاء»\nD) اسم - اسم فاعل (مأخوذ من فعل «شامل» علی وزن «فاعل») / صفة أو نعت للموصوف النکرة",
        "metadata": {
            "image": false,
            "course": "arabic",
            "year": "1399",
            "month": "tir",
            "question_number": "17"
        }
    },
    "18": {
        "question": "عیّن الخطأ فی ضبط حرکات الحروف:\n",
        "options": {
            "1": "عالَمٌ یُنتَفَع بِعلمهِ خَیرِ مِن ألف عابَد!",
            "2": "لَیسَ شَیءٌ أثقَلَ فی المیزانِ من الخُلُق الحسَن!",
            "3": "عَلی کُلِّ النّاس أنْ یَتَعایَشوا تَعایشًا سِلمیًّا!",
            "4": "تُؤدِّی الدَّلافین دَورًا مُهمًّا فی الحَربِ و السِّلم!"
        },
        "final_answer": 1,
        "full_text": "عیّن الخطأ فی ضبط حرکات الحروف:\n\nOptions:\nA) عالَمٌ یُنتَفَع بِعلمهِ خَیرِ مِن ألف عابَد!\nB) لَیسَ شَیءٌ أثقَلَ فی المیزانِ من الخُلُق الحسَن!\nC) عَلی کُلِّ النّاس أنْ یَتَعایَشوا تَعایشًا سِلمیًّا!\nD) تُؤدِّی الدَّلافین دَورًا مُهمًّا فی الحَربِ و السِّلم!",
        "metadata": {
            "image": false,
            "course": "arabic",
            "year": "1399",
            "month": "tir",
            "question_number": "18"
        }
    },
    "19": {
        "question": "عیّن الخطأ:\n",
        "options": {
            "1": "الأرجل: یمشی الإنسان بها!",
            "2": "المُتفرِّج: الّذی یُشجِّع اللاعبَ فی المسابقة!",
            "3": "السائح: من یُفرَح النّاس لزیارة الآثار التاریخیة!",
            "4": "المشکاة: زجاجة فیها مصباح ینتشر الضوءُ من داخلها!"
        },
        "final_answer": 3,
        "full_text": "عیّن الخطأ:\n\nOptions:\nA) الأرجل: یمشی الإنسان بها!\nB) المُتفرِّج: الّذی یُشجِّع اللاعبَ فی المسابقة!\nC) السائح: من یُفرَح النّاس لزیارة الآثار التاریخیة!\nD) المشکاة: زجاجة فیها مصباح ینتشر الضوءُ من داخلها!",
        "metadata": {
            "image": false,
            "course": "arabic",
            "year": "1399",
            "month": "tir",
            "question_number": "19"
        }
    },
    "20": {
        "question": "عیِّن المناسب للفراغین: «أیّام الاُسبوع ......... و الیوم الوسط منها ............!».\n",
        "options": {
            "1": "سبعة - اثنین",
            "2": "سبعة - الثلاثاء",
            "3": "سابعة - الاثنین",
            "4": "سابعة - ثلاثاء"
        },
        "final_answer": 2,
        "full_text": "عیِّن المناسب للفراغین: «أیّام الاُسبوع ......... و الیوم الوسط منها ............!».\n\nOptions:\nA) سبعة - اثنین\nB) سبعة - الثلاثاء\nC) سابعة - الاثنین\nD) سابعة - ثلاثاء",
        "metadata": {
            "image": false,
            "course": "arabic",
            "year": "1399",
            "month": "tir",
            "question_number": "20"
        }
    },
    "21": {
        "question": "عیّن وزن «أفعل» لیس اسم تفضیل:\n",
        "options": {
            "1": "السّکوت أبلغ کلامٍ مقابل الجاهل!",
            "2": "هذه السّورة أعظم السّور فی القرآن الکریم!",
            "3": "مَن أحسن إلیک فأحسن إلیه، و هذا العمل حسنٌ!",
            "4": "الغِنی الأکبر الیأسُ من کلّ ما فی أیدی الآخرین!"
        },
        "final_answer": 3,
        "full_text": "عیّن وزن «أفعل» لیس اسم تفضیل:\n\nOptions:\nA) السّکوت أبلغ کلامٍ مقابل الجاهل!\nB) هذه السّورة أعظم السّور فی القرآن الکریم!\nC) مَن أحسن إلیک فأحسن إلیه، و هذا العمل حسنٌ!\nD) الغِنی الأکبر الیأسُ من کلّ ما فی أیدی الآخرین!",
        "metadata": {
            "image": false,
            "course": "arabic",
            "year": "1399",
            "month": "tir",
            "question_number": "21"
        }
    },
    "22": {
        "question": "عیّن ما فیه «نون الوقایة!»:\n",
        "options": {
            "1": "أیّتها التلمیذة المجتهدة! بیِّنی لزمیلاتک اُسلوب قراءة الدروس!",
            "2": "هل تعرفُ أنّ النّملة تَبنی بَیتَها تحت الأرض و له نوافذ!",
            "3": "لَتمنَّی أن نَصل إلی أهدافنا دون تعب؛ و هذا محال!",
            "4": "أَنقَذنی أحدٌ‌ أصدقائی قبل أن أغرق فی الشّدائد!"
        },
        "final_answer": 4,
        "full_text": "عیّن ما فیه «نون الوقایة!»:\n\nOptions:\nA) أیّتها التلمیذة المجتهدة! بیِّنی لزمیلاتک اُسلوب قراءة الدروس!\nB) هل تعرفُ أنّ النّملة تَبنی بَیتَها تحت الأرض و له نوافذ!\nC) لَتمنَّی أن نَصل إلی أهدافنا دون تعب؛ و هذا محال!\nD) أَنقَذنی أحدٌ‌ أصدقائی قبل أن أغرق فی الشّدائد!",
        "metadata": {
            "image": false,
            "course": "arabic",
            "year": "1399",
            "month": "tir",
            "question_number": "22"
        }
    },
    "23": {
        "question": "عیّن کلمة «ما» مضافًا إلیه (بالنظر إلی المعنی):\n",
        "options": {
            "1": "أعظم ما فی الحیاة أن یبقی العقلُ شابًّا!",
            "2": "لمَ تقول ما لیس لک به علمٌ!",
            "3": "العلمُ ما ینفعک و العقلُ ما یوصلک إلیه!",
            "4": "اُنظر إلی السّماء‌ لیلاً حتّی تُشاهد ما رأیتُه أناً!"
        },
        "final_answer": 1,
        "full_text": "عیّن کلمة «ما» مضافًا إلیه (بالنظر إلی المعنی):\n\nOptions:\nA) أعظم ما فی الحیاة أن یبقی العقلُ شابًّا!\nB) لمَ تقول ما لیس لک به علمٌ!\nC) العلمُ ما ینفعک و العقلُ ما یوصلک إلیه!\nD) اُنظر إلی السّماء‌ لیلاً حتّی تُشاهد ما رأیتُه أناً!",
        "metadata": {
            "image": false,
            "course": "arabic",
            "year": "1399",
            "month": "tir",
            "question_number": "23"
        }
    },
    "24": {
        "question": "عیّن «ما» شرطیّة:\n",
        "options": {
            "1": "ما فعلتُ هذا لک حتّی أتوقّع أجره!",
            "2": "ما تقول عنه فی هذا الاُمر غیر صحیح!",
            "3": "ما تزرع فی الدنیا حتّی تری نتیجته فی الآخرة!",
            "4": "ما تطلب من الخیر للآخرین فإنّک تری نتیجته!"
        },
        "final_answer": 4,
        "full_text": "عیّن «ما» شرطیّة:\n\nOptions:\nA) ما فعلتُ هذا لک حتّی أتوقّع أجره!\nB) ما تقول عنه فی هذا الاُمر غیر صحیح!\nC) ما تزرع فی الدنیا حتّی تری نتیجته فی الآخرة!\nD) ما تطلب من الخیر للآخرین فإنّک تری نتیجته!",
        "metadata": {
            "image": false,
            "course": "arabic",
            "year": "1399",
            "month": "tir",
            "question_number": "24"
        }
    },
    "25": {
        "question": "عیّن حرف المشبّه بالفعل یختلف (فی المعنی):\n",
        "options": {
            "1": "قد جاء فی التاریخ انَّ إبراهیم (ع) أنقذ قومه من عبادة الأصنام!",
            "2": "أیّها الإنسان لاتحزن علی ما فاتک، انّ الیأس یُبعدک من الله!",
            "3": "أیظنّ الإنسانُ انّ الله یترکه سدًی و وحیداً!",
            "4": "إلهنا و ربّنا نعلم انّک مع عبادک دائمًا!"
        },
        "final_answer": 2,
        "full_text": "عیّن حرف المشبّه بالفعل یختلف (فی المعنی):\n\nOptions:\nA) قد جاء فی التاریخ انَّ إبراهیم (ع) أنقذ قومه من عبادة الأصنام!\nB) أیّها الإنسان لاتحزن علی ما فاتک، انّ الیأس یُبعدک من الله!\nC) أیظنّ الإنسانُ انّ الله یترکه سدًی و وحیداً!\nD) إلهنا و ربّنا نعلم انّک مع عبادک دائمًا!",
        "metadata": {
            "image": false,
            "course": "arabic",
            "year": "1399",
            "month": "tir",
            "question_number": "25"
        }
    }
}