{
    "1": {
        "question": "«أَرْسَلْنَا إِلَیٰ فِرْعَوْنَ رَسُولًا فَعَصَیٰ فِرْعَوْنُ الرَّسُولَ»:\n",
        "options": {
            "1": "پیامبر را که برای فرعون مبعوث کردیم، فرعون از او اطاعت نکرد.",
            "2": "بسوی فرعون رسولی فرستادیم، پس فرعون از آن رسول نافرمانی کرد.",
            "3": "رسولی به سوی فرعون گسیل داشتیم، ولی فرعون از رسول ما سرپیچی کرد.",
            "4": "برای فرعون آن پیامبر را ارسال کردیم، پس فرعون بر آن پیامبر عصیان کرد."
        },
        "final_answer": 2,
        "full_text": "«أَرْسَلْنَا إِلَیٰ فِرْعَوْنَ رَسُولًا فَعَصَیٰ فِرْعَوْنُ الرَّسُولَ»:\n\nOptions:\nA) پیامبر را که برای فرعون مبعوث کردیم، فرعون از او اطاعت نکرد.\nB) بسوی فرعون رسولی فرستادیم، پس فرعون از آن رسول نافرمانی کرد.\nC) رسولی به سوی فرعون گسیل داشتیم، ولی فرعون از رسول ما سرپیچی کرد.\nD) برای فرعون آن پیامبر را ارسال کردیم، پس فرعون بر آن پیامبر عصیان کرد.",
        "metadata": {
            "image": false,
            "course": "arabic",
            "year": "1400",
            "month": "tir",
            "question_number": "1"
        }
    },
    "2": {
        "question": "«الصّدقُ کصحّة الإنسان، لایُمکن أن تُدرک قیمتُه إلّا عندما یُفقَد!»:\n",
        "options": {
            "1": "صدق همان سلامتی انسان است، فقط زمانی که از دست برود قدر آن دانسته می‌شود!",
            "2": "صداقت مانند سلامتی انسان است، تا زمانی‌که از دست نرود امکان ندارد ارزش آن درک شود!",
            "3": "راستی همان صحّت بدن انسان است، ارزشش درک نمی‌شود نگر آن‌گاه که آن را از دست بدهد!",
            "4": "درستی همچون سلامت بدن انسان است، نمی‌توانی قدر آن را دریابی مگر زمانی که از دست برود!"
        },
        "final_answer": 2,
        "full_text": "«الصّدقُ کصحّة الإنسان، لایُمکن أن تُدرک قیمتُه إلّا عندما یُفقَد!»:\n\nOptions:\nA) صدق همان سلامتی انسان است، فقط زمانی که از دست برود قدر آن دانسته می‌شود!\nB) صداقت مانند سلامتی انسان است، تا زمانی‌که از دست نرود امکان ندارد ارزش آن درک شود!\nC) راستی همان صحّت بدن انسان است، ارزشش درک نمی‌شود نگر آن‌گاه که آن را از دست بدهد!\nD) درستی همچون سلامت بدن انسان است، نمی‌توانی قدر آن را دریابی مگر زمانی که از دست برود!",
        "metadata": {
            "image": false,
            "course": "arabic",
            "year": "1400",
            "month": "tir",
            "question_number": "2"
        }
    },
    "3": {
        "question": "«إن ذهبنا من نفس الطّریق الّذی کنّا نذهب منه من قبل، وصلنا إلی ذلک المکان الّذی کُنّا نصل إلیه دائماً!»:\n",
        "options": {
            "1": "اگر از راهی برویم که همیشه می‌رفتیم،‌ به آن مکانی می‌رسیم که قبلاً رسیده‌ایم!",
            "2": "اگر از راهی رفتیم که قبلاً رفته بودیم، به همان محلی که دائماً می‌رسیدیم رسیده‌ایم!",
            "3": "اگر از همان راهی رفتیم که دائماً رفته بودیم، به آن محلّی که همیشه می‌رسیدیم، می‌رسیم!",
            "4": "اگر از همان راهی برویم که از قبل می‌رفتیم، به همان مکانی می‌رسیم که همیشه می‌رسیدیم!"
        },
        "final_answer": 4,
        "full_text": "«إن ذهبنا من نفس الطّریق الّذی کنّا نذهب منه من قبل، وصلنا إلی ذلک المکان الّذی کُنّا نصل إلیه دائماً!»:\n\nOptions:\nA) اگر از راهی برویم که همیشه می‌رفتیم،‌ به آن مکانی می‌رسیم که قبلاً رسیده‌ایم!\nB) اگر از راهی رفتیم که قبلاً رفته بودیم، به همان محلی که دائماً می‌رسیدیم رسیده‌ایم!\nC) اگر از همان راهی رفتیم که دائماً رفته بودیم، به آن محلّی که همیشه می‌رسیدیم، می‌رسیم!\nD) اگر از همان راهی برویم که از قبل می‌رفتیم، به همان مکانی می‌رسیم که همیشه می‌رسیدیم!",
        "metadata": {
            "image": false,
            "course": "arabic",
            "year": "1400",
            "month": "tir",
            "question_number": "3"
        }
    },
    "4": {
        "question": "«من یؤمن بأنّه سینجح فی طریقة، لاشکَ أنّه قد استطاع أن یُوصل نفسه إلی نصف الطّریق!»:\n",
        "options": {
            "1": "هرکس ایمان داشته باشد که او در راهش پیروز خواهد شد، شکّی نیست که خودش می‌تواند به نیمهٔ راه برسد!",
            "2": "آن کس که ایمان داشت که در آینده در راه خود موفق خواهد شد، حتماً خود توانسته است به اواسط راه برسد!",
            "3": "کسی که ایمان داشته باشد به این‌که در راهش موفق خواهد شد، بی‌شک توانسته است خود را به نیمهٔ راه برساند!",
            "4": "هر آن‌کس که ایمان دارد به این‌که در مسیرش پیروز خواهد شد، قطعاً خواهد توانست که خود را به اواسط مسیر برساند!"
        },
        "final_answer": 3,
        "full_text": "«من یؤمن بأنّه سینجح فی طریقة، لاشکَ أنّه قد استطاع أن یُوصل نفسه إلی نصف الطّریق!»:\n\nOptions:\nA) هرکس ایمان داشته باشد که او در راهش پیروز خواهد شد، شکّی نیست که خودش می‌تواند به نیمهٔ راه برسد!\nB) آن کس که ایمان داشت که در آینده در راه خود موفق خواهد شد، حتماً خود توانسته است به اواسط راه برسد!\nC) کسی که ایمان داشته باشد به این‌که در راهش موفق خواهد شد، بی‌شک توانسته است خود را به نیمهٔ راه برساند!\nD) هر آن‌کس که ایمان دارد به این‌که در مسیرش پیروز خواهد شد، قطعاً خواهد توانست که خود را به اواسط مسیر برساند!",
        "metadata": {
            "image": false,
            "course": "arabic",
            "year": "1400",
            "month": "tir",
            "question_number": "4"
        }
    },
    "5": {
        "question": "«الاحتفاظ بالواحدة فصلٌ لاُمتنا المفکِّرة، ولکن الأعداءَ یُشجعون عملاءهُم أن یُفرّقونا!»:\n",
        "options": {
            "1": "حفظ وحدت، برتری برای امّت متفکر ماست، که دشمنانمان عوامل خود را به پراکنده ساختن ما تشویق می‌کنند!",
            "2": "حفظ وحدت، برای امّت متفکر ما فضیلتی است، ولی دشمنان، مزدوان خود را تشویق می‌کنند که ما را پراکنده کنند!",
            "3": "نگه داشتن وحدت امّت اندیشمندمان، فضیلتی است که دشمنان ما مزدوان را تشویق می‌کنند ما را پراکنده سازند!",
            "4": "نگه داشتن وحدت برای امّت ما که اندیشمند است فضیلتی بشمار می‌آید، ولی دشمنان عوامل خود را تشویق به پراکنده شدن ما می‌کنند!"
        },
        "final_answer": 2,
        "full_text": "«الاحتفاظ بالواحدة فصلٌ لاُمتنا المفکِّرة، ولکن الأعداءَ یُشجعون عملاءهُم أن یُفرّقونا!»:\n\nOptions:\nA) حفظ وحدت، برتری برای امّت متفکر ماست، که دشمنانمان عوامل خود را به پراکنده ساختن ما تشویق می‌کنند!\nB) حفظ وحدت، برای امّت متفکر ما فضیلتی است، ولی دشمنان، مزدوان خود را تشویق می‌کنند که ما را پراکنده کنند!\nC) نگه داشتن وحدت امّت اندیشمندمان، فضیلتی است که دشمنان ما مزدوان را تشویق می‌کنند ما را پراکنده سازند!\nD) نگه داشتن وحدت برای امّت ما که اندیشمند است فضیلتی بشمار می‌آید، ولی دشمنان عوامل خود را تشویق به پراکنده شدن ما می‌کنند!",
        "metadata": {
            "image": false,
            "course": "arabic",
            "year": "1400",
            "month": "tir",
            "question_number": "5"
        }
    },
    "6": {
        "question": "«مَن یَری النّاس صِغارًا، کالّذی هو واقف علی قمّة الجبل، یراه النّاس صغیراً أیضًا»:\n",
        "options": {
            "1": "آن‌که مردم در نظرش کوچکند، مثل کسی است که بر قلّه‌ای از کوه ایستاده، او هم در نظر مردم کوچک می‌نماید!",
            "2": "هرکس مردم را کوچک دید، همچون کسی است که بر قلّه‌ای در کوه ایستاده، مردم هم او را کوچک می‌بینند!",
            "3": "کسی‌که مردم را کوچک می‌بیند، چون کسی است که بر قلّهٔ کوه ایستاده، مردم نیز او را کوچک می‌بینند!",
            "4": "هر آن‌که مردم را کوچک انگاشت، همان کس است که روی قلّه کوه ایستاده، مردم هم او را کوچک می‌انگارند!"
        },
        "final_answer": 3,
        "full_text": "«مَن یَری النّاس صِغارًا، کالّذی هو واقف علی قمّة الجبل، یراه النّاس صغیراً أیضًا»:\n\nOptions:\nA) آن‌که مردم در نظرش کوچکند، مثل کسی است که بر قلّه‌ای از کوه ایستاده، او هم در نظر مردم کوچک می‌نماید!\nB) هرکس مردم را کوچک دید، همچون کسی است که بر قلّه‌ای در کوه ایستاده، مردم هم او را کوچک می‌بینند!\nC) کسی‌که مردم را کوچک می‌بیند، چون کسی است که بر قلّهٔ کوه ایستاده، مردم نیز او را کوچک می‌بینند!\nD) هر آن‌که مردم را کوچک انگاشت، همان کس است که روی قلّه کوه ایستاده، مردم هم او را کوچک می‌انگارند!",
        "metadata": {
            "image": false,
            "course": "arabic",
            "year": "1400",
            "month": "tir",
            "question_number": "6"
        }
    },
    "7": {
        "question": "«کان رجالُ هاتین القبیلتین یَنهبون أموالَ النّاس من طریق ذلک المضیق حتّی اُغلِق بسدِّ عظیم من الحدید و النحاس المذاب»:\n",
        "options": {
            "1": "مردان این دو قبیله اموال مردم را از راه آن تنگه به یغما می‌بردند تا این‌که با سدّ بزرگی از آهن و مس ذوب شده، بسته شد.",
            "2": "مردان آن دو قبیله اموال مردمان را از طریق این تنگه غارت کردند تا این‌که بوسیلهٔ سدّ بزرگی از آهن و مس مذاب بسته شد.",
            "3": "بزرگان این دو قبیله دارائی‌های مردم را از راه آن تنگه به یغما می‌برند تا این‌که با سدّی بزرگ از مس و آهن آب شده بسته شود.",
            "4": "بزرگان آن دو قبیله دارائی‌های مردمان را از طریق آن تنگه غارت می‌کردند تا این‌که به وسیلهٔ سدّی بزرگ از مس و آهن آن را بستند."
        },
        "final_answer": 1,
        "full_text": "«کان رجالُ هاتین القبیلتین یَنهبون أموالَ النّاس من طریق ذلک المضیق حتّی اُغلِق بسدِّ عظیم من الحدید و النحاس المذاب»:\n\nOptions:\nA) مردان این دو قبیله اموال مردم را از راه آن تنگه به یغما می‌بردند تا این‌که با سدّ بزرگی از آهن و مس ذوب شده، بسته شد.\nB) مردان آن دو قبیله اموال مردمان را از طریق این تنگه غارت کردند تا این‌که بوسیلهٔ سدّ بزرگی از آهن و مس مذاب بسته شد.\nC) بزرگان این دو قبیله دارائی‌های مردم را از راه آن تنگه به یغما می‌برند تا این‌که با سدّی بزرگ از مس و آهن آب شده بسته شود.\nD) بزرگان آن دو قبیله دارائی‌های مردمان را از طریق آن تنگه غارت می‌کردند تا این‌که به وسیلهٔ سدّی بزرگ از مس و آهن آن را بستند.",
        "metadata": {
            "image": false,
            "course": "arabic",
            "year": "1400",
            "month": "tir",
            "question_number": "7"
        }
    },
    "8": {
        "question": "عیّن الصحیح:\n",
        "options": {
            "1": "کان صدیقی ألف کتاباً توجَد فیه قصصَّ مفیدة: دوستم کتابی تألیف کرد. در آن داستان‌های مفیدی می‌یابی!",
            "2": "للاعبی المباراة وقت محدّد یجب أداء أعمالهم فیه: بازیکنان مسابقه در وقت مشخص باید کارها را انجام دهند!",
            "3": "اللّهم اِجعلنا ممّن یتوبون إلیک فتقبلهم: خدایا ما را از کسانی قرار بده که به سوی تو توبه می‌کنند و آن‌ها را می‌پذیری!",
            "4": "إن لم یتعایش الناس بعضهم بعضاً فلاسبیل لتقدّم بلدهم: مردم باید با یکدیگر همزیستی مسالمت‌آمیز داشته باشند تا راهی برای پیشرفت کشورشان بیابند!"
        },
        "final_answer": 3,
        "full_text": "عیّن الصحیح:\n\nOptions:\nA) کان صدیقی ألف کتاباً توجَد فیه قصصَّ مفیدة: دوستم کتابی تألیف کرد. در آن داستان‌های مفیدی می‌یابی!\nB) للاعبی المباراة وقت محدّد یجب أداء أعمالهم فیه: بازیکنان مسابقه در وقت مشخص باید کارها را انجام دهند!\nC) اللّهم اِجعلنا ممّن یتوبون إلیک فتقبلهم: خدایا ما را از کسانی قرار بده که به سوی تو توبه می‌کنند و آن‌ها را می‌پذیری!\nD) إن لم یتعایش الناس بعضهم بعضاً فلاسبیل لتقدّم بلدهم: مردم باید با یکدیگر همزیستی مسالمت‌آمیز داشته باشند تا راهی برای پیشرفت کشورشان بیابند!",
        "metadata": {
            "image": false,
            "course": "arabic",
            "year": "1400",
            "month": "tir",
            "question_number": "8"
        }
    },
    "9": {
        "question": "عیّن الخطأ:\n",
        "options": {
            "1": "بالحلم عن السّفیه یکثرُ الأنصارُ: بردباری بر نادان یاران را زیاد می‌کند!",
            "2": "سیأتی الغدُ بکثیر مِمّا لا تَعرفون: فردا بسیاری از آن‌چه را نمی‌دانید خواهد آورد!",
            "3": "الله الّذی یَنصر المُجاهدین و هُم قلیلون: خدا کسی است که مجاهدان را با این‌که اندک‌اند یاری می‌کند!",
            "4": "یوجَد النّفطُ تَحت طبقاتِ الأرض بعد مرور قرونٍ: نفت زیر طبقات زمین بعد از گذشتن قرن‌ها یافت می‌شود!"
        },
        "final_answer": 1,
        "full_text": "عیّن الخطأ:\n\nOptions:\nA) بالحلم عن السّفیه یکثرُ الأنصارُ: بردباری بر نادان یاران را زیاد می‌کند!\nB) سیأتی الغدُ بکثیر مِمّا لا تَعرفون: فردا بسیاری از آن‌چه را نمی‌دانید خواهد آورد!\nC) الله الّذی یَنصر المُجاهدین و هُم قلیلون: خدا کسی است که مجاهدان را با این‌که اندک‌اند یاری می‌کند!\nD) یوجَد النّفطُ تَحت طبقاتِ الأرض بعد مرور قرونٍ: نفت زیر طبقات زمین بعد از گذشتن قرن‌ها یافت می‌شود!",
        "metadata": {
            "image": false,
            "course": "arabic",
            "year": "1400",
            "month": "tir",
            "question_number": "9"
        }
    },
    "10": {
        "question": "«کشاورز را دیدم در حالی که محصول را جمع می‌کرد.» عیّن الصحیح:\n",
        "options": {
            "1": "شاهدتُ فلّاحًا و هو یجمع محصولَه.",
            "2": "شاهدتُ فلّاحًا و هو یجمع المحصولَ.",
            "3": "رأیتُ الفلّاح و هو یَجمع محصولا.",
            "4": "رأیتُ الفلّاح و هو یَجمع المحصول."
        },
        "final_answer": 4,
        "full_text": "«کشاورز را دیدم در حالی که محصول را جمع می‌کرد.» عیّن الصحیح:\n\nOptions:\nA) شاهدتُ فلّاحًا و هو یجمع محصولَه.\nB) شاهدتُ فلّاحًا و هو یجمع المحصولَ.\nC) رأیتُ الفلّاح و هو یَجمع محصولا.\nD) رأیتُ الفلّاح و هو یَجمع المحصول.",
        "metadata": {
            "image": false,
            "course": "arabic",
            "year": "1400",
            "month": "tir",
            "question_number": "10"
        }
    },
    "11": {
        "question": "اقرأ النّص التّالی ثمّ أجب عن الأسئله بما یناسب النص:\nالإنسان المثالیّ الّذی یَسعی للمجد هو الإنسان الّذی ینظر إلی العالَم کساحة لا یُری فیها إلّا الحرکة و النشاط، حیث إنّ الرخوة و السّکون یُساویان الموت! و کذلک إنّ کلُ من فی الوجود إذا أراد النّصرَ و الظّفر مُلزم بمواجهة العالَم کمجموعة فیها نزول و صعود لا حیلة منهما و لا یُمکن اختیار أحدِهما دون الآخر!\nفإنّ المصاعب الّتی تقع فی سبیل الطالب - علی سبیل المثال - هی الّتی تقع قلیلاً أو کثیرًا أو مشابهًا فی سبیل الآخرین. فمن کانت نفسُه مُتَّسِعةُ تقبل الحیاة بما فیها من دون ضجر، ولکن من کانت الحیاة أکبر منه و الّذی صغَّر شأنَ نفسه فالحیاة تتغلب علیه، فحیننذٍ یعیش هذا الإنسانُ مأیوسًا یلعن الآخرین بحُجّة أنّهم لم یکونوا فی سبیل قضاء حوائجه!\nعیّن الصحیح:\n",
        "options": {
            "1": "الحیاة تواجه أبناء البشر مواجهة متشابهة!",
            "2": "مقدار المصاعب یتساوی فی جمیع أبناء البشر!",
            "3": "الرّخوة و النّزول و الصّعود ممّا لا حیلة منها أبذًا!",
            "4": "المأیوس یعیش و هو یفکّر فی قضاء حوائج الآخرین!"
        },
        "final_answer": 1,
        "full_text": "اقرأ النّص التّالی ثمّ أجب عن الأسئله بما یناسب النص:\nالإنسان المثالیّ الّذی یَسعی للمجد هو الإنسان الّذی ینظر إلی العالَم کساحة لا یُری فیها إلّا الحرکة و النشاط، حیث إنّ الرخوة و السّکون یُساویان الموت! و کذلک إنّ کلُ من فی الوجود إذا أراد النّصرَ و الظّفر مُلزم بمواجهة العالَم کمجموعة فیها نزول و صعود لا حیلة منهما و لا یُمکن اختیار أحدِهما دون الآخر!\nفإنّ المصاعب الّتی تقع فی سبیل الطالب - علی سبیل المثال - هی الّتی تقع قلیلاً أو کثیرًا أو مشابهًا فی سبیل الآخرین. فمن کانت نفسُه مُتَّسِعةُ تقبل الحیاة بما فیها من دون ضجر، ولکن من کانت الحیاة أکبر منه و الّذی صغَّر شأنَ نفسه فالحیاة تتغلب علیه، فحیننذٍ یعیش هذا الإنسانُ مأیوسًا یلعن الآخرین بحُجّة أنّهم لم یکونوا فی سبیل قضاء حوائجه!\nعیّن الصحیح:\n\nOptions:\nA) الحیاة تواجه أبناء البشر مواجهة متشابهة!\nB) مقدار المصاعب یتساوی فی جمیع أبناء البشر!\nC) الرّخوة و النّزول و الصّعود ممّا لا حیلة منها أبذًا!\nD) المأیوس یعیش و هو یفکّر فی قضاء حوائج الآخرین!",
        "metadata": {
            "image": false,
            "course": "arabic",
            "year": "1400",
            "month": "tir",
            "question_number": "11"
        }
    },
    "12": {
        "question": "عیّن الصحیح:\n",
        "options": {
            "1": "إنّ النّزول و الصعود من أسباب الإنسان المثالی للوصول إلی المجد!",
            "2": "من کانت نفسه متّسعة فلا یری المصاعب إلّا فی طریقه فقط!",
            "3": "لا مصاعب إلّا فی طریق الإنسان المأیوس!",
            "4": "لا یشعر بالسّوء مَن یقبل الحیاة بما فیها!"
        },
        "final_answer": 4,
        "full_text": "اقرأ النّص التّالی ثمّ أجب عن الأسئله بما یناسب النص:\nالإنسان المثالیّ الّذی یَسعی للمجد هو الإنسان الّذی ینظر إلی العالَم کساحة لا یُری فیها إلّا الحرکة و النشاط، حیث إنّ الرخوة و السّکون یُساویان الموت! و کذلک إنّ کلُ من فی الوجود إذا أراد النّصرَ و الظّفر مُلزم بمواجهة العالَم کمجموعة فیها نزول و صعود لا حیلة منهما و لا یُمکن اختیار أحدِهما دون الآخر!\nفإنّ المصاعب الّتی تقع فی سبیل الطالب - علی سبیل المثال - هی الّتی تقع قلیلاً أو کثیرًا أو مشابهًا فی سبیل الآخرین. فمن کانت نفسُه مُتَّسِعةُ تقبل الحیاة بما فیها من دون ضجر، ولکن من کانت الحیاة أکبر منه و الّذی صغَّر شأنَ نفسه فالحیاة تتغلب علیه، فحیننذٍ یعیش هذا الإنسانُ مأیوسًا یلعن الآخرین بحُجّة أنّهم لم یکونوا فی سبیل قضاء حوائجه!\nعیّن الصحیح:\n\nOptions:\nA) إنّ النّزول و الصعود من أسباب الإنسان المثالی للوصول إلی المجد!\nB) من کانت نفسه متّسعة فلا یری المصاعب إلّا فی طریقه فقط!\nC) لا مصاعب إلّا فی طریق الإنسان المأیوس!\nD) لا یشعر بالسّوء مَن یقبل الحیاة بما فیها!",
        "metadata": {
            "image": false,
            "course": "arabic",
            "year": "1400",
            "month": "tir",
            "question_number": "12"
        }
    },
    "13": {
        "question": "من هو الإنسان الّذی مرافقُه النّصرُ و الظّفر؟ عیّن الخطأ:\n",
        "options": {
            "1": "من تتغلّب الحیاة علیه!",
            "2": "من لا یری الحیاة بوجه واحد فقط!",
            "3": "من لا یفکّر فقط بوقوع ما یحبّه!",
            "4": "من یری أنّ النشاط هو من السّنن الإلهیّة!"
        },
        "final_answer": 1,
        "full_text": "اقرأ النّص التّالی ثمّ أجب عن الأسئله بما یناسب النص:\nالإنسان المثالیّ الّذی یَسعی للمجد هو الإنسان الّذی ینظر إلی العالَم کساحة لا یُری فیها إلّا الحرکة و النشاط، حیث إنّ الرخوة و السّکون یُساویان الموت! و کذلک إنّ کلُ من فی الوجود إذا أراد النّصرَ و الظّفر مُلزم بمواجهة العالَم کمجموعة فیها نزول و صعود لا حیلة منهما و لا یُمکن اختیار أحدِهما دون الآخر!\nفإنّ المصاعب الّتی تقع فی سبیل الطالب - علی سبیل المثال - هی الّتی تقع قلیلاً أو کثیرًا أو مشابهًا فی سبیل الآخرین. فمن کانت نفسُه مُتَّسِعةُ تقبل الحیاة بما فیها من دون ضجر، ولکن من کانت الحیاة أکبر منه و الّذی صغَّر شأنَ نفسه فالحیاة تتغلب علیه، فحیننذٍ یعیش هذا الإنسانُ مأیوسًا یلعن الآخرین بحُجّة أنّهم لم یکونوا فی سبیل قضاء حوائجه!\nمن هو الإنسان الّذی مرافقُه النّصرُ و الظّفر؟ عیّن الخطأ:\n\nOptions:\nA) من تتغلّب الحیاة علیه!\nB) من لا یری الحیاة بوجه واحد فقط!\nC) من لا یفکّر فقط بوقوع ما یحبّه!\nD) من یری أنّ النشاط هو من السّنن الإلهیّة!",
        "metadata": {
            "image": false,
            "course": "arabic",
            "year": "1400",
            "month": "tir",
            "question_number": "13"
        }
    },
    "14": {
        "question": "عیّن ما هو الأنسب للعبارة التالیة:\n«إنّ المصاعب الّتی تقع سبیل الطّالب هی الّتی تقع فی سبیل الآخرین.»\n",
        "options": {
            "1": "النّجاح وقفٌ علی من لا ینام!",
            "2": "لعلٌ العُسر یُصبح یُسرًا فی الغد!",
            "3": "الدّهر یومان یوم لک و یوم علیک!",
            "4": "الدّنیا محفوقة بالبلایا! (محفوقة: مستورة)"
        },
        "final_answer": 4,
        "full_text": "اقرأ النّص التّالی ثمّ أجب عن الأسئله بما یناسب النص:\nالإنسان المثالیّ الّذی یَسعی للمجد هو الإنسان الّذی ینظر إلی العالَم کساحة لا یُری فیها إلّا الحرکة و النشاط، حیث إنّ الرخوة و السّکون یُساویان الموت! و کذلک إنّ کلُ من فی الوجود إذا أراد النّصرَ و الظّفر مُلزم بمواجهة العالَم کمجموعة فیها نزول و صعود لا حیلة منهما و لا یُمکن اختیار أحدِهما دون الآخر!\nفإنّ المصاعب الّتی تقع فی سبیل الطالب - علی سبیل المثال - هی الّتی تقع قلیلاً أو کثیرًا أو مشابهًا فی سبیل الآخرین. فمن کانت نفسُه مُتَّسِعةُ تقبل الحیاة بما فیها من دون ضجر، ولکن من کانت الحیاة أکبر منه و الّذی صغَّر شأنَ نفسه فالحیاة تتغلب علیه، فحیننذٍ یعیش هذا الإنسانُ مأیوسًا یلعن الآخرین بحُجّة أنّهم لم یکونوا فی سبیل قضاء حوائجه!\nعیّن ما هو الأنسب للعبارة التالیة:\n«إنّ المصاعب الّتی تقع سبیل الطّالب هی الّتی تقع فی سبیل الآخرین.»\n\nOptions:\nA) النّجاح وقفٌ علی من لا ینام!\nB) لعلٌ العُسر یُصبح یُسرًا فی الغد!\nC) الدّهر یومان یوم لک و یوم علیک!\nD) الدّنیا محفوقة بالبلایا! (محفوقة: مستورة)",
        "metadata": {
            "image": false,
            "course": "arabic",
            "year": "1400",
            "month": "tir",
            "question_number": "14"
        }
    },
    "15": {
        "question": "عیّن الخطأ فی الإعراب و التحلیل الصرفی: «کانت»:\n",
        "options": {
            "1": "فعل ماضٍ - للمفرد المؤنث الغائب / من الأفعال الناقصة، بمعنی «بود»",
            "2": "فعل ماضٍ - للمفرد المؤنث / فعلٌ من الأفعال الناقصة، و الجملة جواب شرط",
            "3": "ماضٍ - للمفرد - حروفه الأصلیة ثلاثة / فعل من الأفعال الناقصة، بمعنی «بود»",
            "4": "ماضٍ - للمؤنث - له ثلاثة حروف أصلیة / من الأفعال الناقصة، و الجملة شرطیة"
        },
        "final_answer": 2,
        "full_text": "اقرأ النّص التّالی ثمّ أجب عن الأسئله بما یناسب النص:\nالإنسان المثالیّ الّذی یَسعی للمجد هو الإنسان الّذی ینظر إلی العالَم کساحة لا یُری فیها إلّا الحرکة و النشاط، حیث إنّ الرخوة و السّکون یُساویان الموت! و کذلک إنّ کلُ من فی الوجود إذا أراد النّصرَ و الظّفر مُلزم بمواجهة العالَم کمجموعة فیها نزول و صعود لا حیلة منهما و لا یُمکن اختیار أحدِهما دون الآخر!\nفإنّ المصاعب الّتی تقع فی سبیل الطالب - علی سبیل المثال - هی الّتی تقع قلیلاً أو کثیرًا أو مشابهًا فی سبیل الآخرین. فمن کانت نفسُه مُتَّسِعةُ تقبل الحیاة بما فیها من دون ضجر، ولکن من کانت الحیاة أکبر منه و الّذی صغَّر شأنَ نفسه فالحیاة تتغلب علیه، فحیننذٍ یعیش هذا الإنسانُ مأیوسًا یلعن الآخرین بحُجّة أنّهم لم یکونوا فی سبیل قضاء حوائجه!\nعیّن الخطأ فی الإعراب و التحلیل الصرفی: «کانت»:\n\nOptions:\nA) فعل ماضٍ - للمفرد المؤنث الغائب / من الأفعال الناقصة، بمعنی «بود»\nB) فعل ماضٍ - للمفرد المؤنث / فعلٌ من الأفعال الناقصة، و الجملة جواب شرط\nC) ماضٍ - للمفرد - حروفه الأصلیة ثلاثة / فعل من الأفعال الناقصة، بمعنی «بود»\nD) ماضٍ - للمؤنث - له ثلاثة حروف أصلیة / من الأفعال الناقصة، و الجملة شرطیة",
        "metadata": {
            "image": false,
            "course": "arabic",
            "year": "1400",
            "month": "tir",
            "question_number": "15"
        }
    },
    "16": {
        "question": "عیّن الخطأ فی الإعراب و التحلیل الصرفی: «صغَّر»:\n",
        "options": {
            "1": "ماضٍ - للمفرد الغائب - له حرف واحد زائد - معلوم / فعل و مفعوله «شأن»",
            "2": "ماضٍ - للمفرد المذکر الغائب - مصدره علی وزن تفعیل - معلوم / فعلٌ و مع فاعله جملةٌ فعلیة",
            "3": "فعل ماضٍ - له حرف زائد و مصدره «تصغیر» علی وزن تفعیل / فعل و فاعل، و الجملة فعلیةٌ",
            "4": "فعل ماضٍ - له حرف واحد زائد، و مصدره علی وزن «تفعّل» / فعل و فاعل، و الجملةُ فعلیةٌ"
        },
        "final_answer": 4,
        "full_text": "اقرأ النّص التّالی ثمّ أجب عن الأسئله بما یناسب النص:\nالإنسان المثالیّ الّذی یَسعی للمجد هو الإنسان الّذی ینظر إلی العالَم کساحة لا یُری فیها إلّا الحرکة و النشاط، حیث إنّ الرخوة و السّکون یُساویان الموت! و کذلک إنّ کلُ من فی الوجود إذا أراد النّصرَ و الظّفر مُلزم بمواجهة العالَم کمجموعة فیها نزول و صعود لا حیلة منهما و لا یُمکن اختیار أحدِهما دون الآخر!\nفإنّ المصاعب الّتی تقع فی سبیل الطالب - علی سبیل المثال - هی الّتی تقع قلیلاً أو کثیرًا أو مشابهًا فی سبیل الآخرین. فمن کانت نفسُه مُتَّسِعةُ تقبل الحیاة بما فیها من دون ضجر، ولکن من کانت الحیاة أکبر منه و الّذی صغَّر شأنَ نفسه فالحیاة تتغلب علیه، فحیننذٍ یعیش هذا الإنسانُ مأیوسًا یلعن الآخرین بحُجّة أنّهم لم یکونوا فی سبیل قضاء حوائجه!\nعیّن الخطأ فی الإعراب و التحلیل الصرفی: «صغَّر»:\n\nOptions:\nA) ماضٍ - للمفرد الغائب - له حرف واحد زائد - معلوم / فعل و مفعوله «شأن»\nB) ماضٍ - للمفرد المذکر الغائب - مصدره علی وزن تفعیل - معلوم / فعلٌ و مع فاعله جملةٌ فعلیة\nC) فعل ماضٍ - له حرف زائد و مصدره «تصغیر» علی وزن تفعیل / فعل و فاعل، و الجملة فعلیةٌ\nD) فعل ماضٍ - له حرف واحد زائد، و مصدره علی وزن «تفعّل» / فعل و فاعل، و الجملةُ فعلیةٌ",
        "metadata": {
            "image": false,
            "course": "arabic",
            "year": "1400",
            "month": "tir",
            "question_number": "16"
        }
    },
    "17": {
        "question": "عیّن الخطأ فی الإعراب و التحلیل الصرفی: «الطالب»:\n",
        "options": {
            "1": "مفرد مذکر - اسم فاعل (فعله: طَلَب) - معرّف بأل / مضاف‌إلیه للمضاف «سبیل»",
            "2": "اسم - مفرد مذکر - اسم فاعل (فعله: طَلَب، و مصدره: مطالبة) / مضاف‌إلیه",
            "3": "مفرد مذکر - اسم فاعل (فعله: «طلب» بدون حرف زائد) - معرّف بأل",
            "4": "اسم - مفرد - اسم فاعل (من فعل «طلب» و اسم مفعوله: مطلوب)"
        },
        "final_answer": 2,
        "full_text": "اقرأ النّص التّالی ثمّ أجب عن الأسئله بما یناسب النص:\nالإنسان المثالیّ الّذی یَسعی للمجد هو الإنسان الّذی ینظر إلی العالَم کساحة لا یُری فیها إلّا الحرکة و النشاط، حیث إنّ الرخوة و السّکون یُساویان الموت! و کذلک إنّ کلُ من فی الوجود إذا أراد النّصرَ و الظّفر مُلزم بمواجهة العالَم کمجموعة فیها نزول و صعود لا حیلة منهما و لا یُمکن اختیار أحدِهما دون الآخر!\nفإنّ المصاعب الّتی تقع فی سبیل الطالب - علی سبیل المثال - هی الّتی تقع قلیلاً أو کثیرًا أو مشابهًا فی سبیل الآخرین. فمن کانت نفسُه مُتَّسِعةُ تقبل الحیاة بما فیها من دون ضجر، ولکن من کانت الحیاة أکبر منه و الّذی صغَّر شأنَ نفسه فالحیاة تتغلب علیه، فحیننذٍ یعیش هذا الإنسانُ مأیوسًا یلعن الآخرین بحُجّة أنّهم لم یکونوا فی سبیل قضاء حوائجه!\nعیّن الخطأ فی الإعراب و التحلیل الصرفی: «الطالب»:\n\nOptions:\nA) مفرد مذکر - اسم فاعل (فعله: طَلَب) - معرّف بأل / مضاف‌إلیه للمضاف «سبیل»\nB) اسم - مفرد مذکر - اسم فاعل (فعله: طَلَب، و مصدره: مطالبة) / مضاف‌إلیه\nC) مفرد مذکر - اسم فاعل (فعله: «طلب» بدون حرف زائد) - معرّف بأل\nD) اسم - مفرد - اسم فاعل (من فعل «طلب» و اسم مفعوله: مطلوب)",
        "metadata": {
            "image": false,
            "course": "arabic",
            "year": "1400",
            "month": "tir",
            "question_number": "17"
        }
    },
    "18": {
        "question": "عیّن الخطأ فی ضبط حرکات الحروف:\n",
        "options": {
            "1": "العِلمُ نورٌ و ضیاء یَقذِفُهُ اللهُ فی قُلوبِ أولیائهِ.",
            "2": "رُبَّ کِتاب تَجتَهدُ فی قِراءتِهِ، ثُمَّ لا تَحصُلُ عَلی فائدةٍ مِنهُ.",
            "3": "عِندَما یَنقَطِعُ تَیّارُ الکَهرباء فی الَّیلِ، یَغرَقُ کُلُّ مَکانٍ فی الظَّلامِ.",
            "4": "فی یَومِ مِنَ الأیّامِ جَماعةُ مِنَ المُسافرینِ واقَفینَ أمام المَسجِدِ."
        },
        "final_answer": 4,
        "full_text": "عیّن الخطأ فی ضبط حرکات الحروف:\n\nOptions:\nA) العِلمُ نورٌ و ضیاء یَقذِفُهُ اللهُ فی قُلوبِ أولیائهِ.\nB) رُبَّ کِتاب تَجتَهدُ فی قِراءتِهِ، ثُمَّ لا تَحصُلُ عَلی فائدةٍ مِنهُ.\nC) عِندَما یَنقَطِعُ تَیّارُ الکَهرباء فی الَّیلِ، یَغرَقُ کُلُّ مَکانٍ فی الظَّلامِ.\nD) فی یَومِ مِنَ الأیّامِ جَماعةُ مِنَ المُسافرینِ واقَفینَ أمام المَسجِدِ.",
        "metadata": {
            "image": false,
            "course": "arabic",
            "year": "1400",
            "month": "tir",
            "question_number": "18"
        }
    },
    "19": {
        "question": "عیّن الخطأ:\n",
        "options": {
            "1": "أسرّی: تحرَّک لیلاً (لاصباحًا)!",
            "2": "المستنقع: مکان فیه میاه و رائحة میاهه کریهة!",
            "3": "الغیم: نوع من السّحاب لاینزل منه إلّا المطر!",
            "4": "الفریق: جماعة من النّاس الّذین لهم هدف واحد!"
        },
        "final_answer": 3,
        "full_text": "عیّن الخطأ:\n\nOptions:\nA) أسرّی: تحرَّک لیلاً (لاصباحًا)!\nB) المستنقع: مکان فیه میاه و رائحة میاهه کریهة!\nC) الغیم: نوع من السّحاب لاینزل منه إلّا المطر!\nD) الفریق: جماعة من النّاس الّذین لهم هدف واحد!",
        "metadata": {
            "image": false,
            "course": "arabic",
            "year": "1400",
            "month": "tir",
            "question_number": "19"
        }
    },
    "20": {
        "question": "عیّن الخطأ عن تعیین الساعة: الثانیة عشرة إلّا ربعًاک\n",
        "options": {
            "1": "۱۱/۴۵",
            "2": "الحادیة عشرة و خمس و أربعون دقیقة",
            "3": "۱۱ و ۳۰ دقیقه",
            "4": "۱۲ إلا خمس‌عشرة دقیقة"
        },
        "final_answer": 3,
        "full_text": "عیّن الخطأ عن تعیین الساعة: الثانیة عشرة إلّا ربعًاک\n\nOptions:\nA) ۱۱/۴۵\nB) الحادیة عشرة و خمس و أربعون دقیقة\nC) ۱۱ و ۳۰ دقیقه\nD) ۱۲ إلا خمس‌عشرة دقیقة",
        "metadata": {
            "image": false,
            "course": "arabic",
            "year": "1400",
            "month": "tir",
            "question_number": "20"
        }
    },
    "21": {
        "question": "عیّن ما فیه «اسم التفضیل» أکثر:\n",
        "options": {
            "1": "أعوذ من الشّرور بأحسن الخالقین!",
            "2": "أشرف النّاس من یکون رؤوفًا للاُسرة!",
            "3": "اُحبّ أوسط الاُمور لأنّها خیر الأعمال!",
            "4": "أفظلکُم مَن هو ألین و ألطف للآخرین!"
        },
        "final_answer": 4,
        "full_text": "عیّن ما فیه «اسم التفضیل» أکثر:\n\nOptions:\nA) أعوذ من الشّرور بأحسن الخالقین!\nB) أشرف النّاس من یکون رؤوفًا للاُسرة!\nC) اُحبّ أوسط الاُمور لأنّها خیر الأعمال!\nD) أفظلکُم مَن هو ألین و ألطف للآخرین!",
        "metadata": {
            "image": false,
            "course": "arabic",
            "year": "1400",
            "month": "tir",
            "question_number": "21"
        }
    },
    "22": {
        "question": "عیّن ما فیه لام الأمر:\n",
        "options": {
            "1": "عند مشاهدة آثار قدرة الله لیخشع القلب!",
            "2": "ساعِد أصدقاءک لیخرجوا من مشاکلهم بسهولة!",
            "3": "یجب علی الإنسان کثیرٌ من المحاولات لیُصلح نفسه!",
            "4": "ذهب صدیقی إلی متجر آخر لیشتری سروالا أرخص!"
        },
        "final_answer": 1,
        "full_text": "عیّن ما فیه لام الأمر:\n\nOptions:\nA) عند مشاهدة آثار قدرة الله لیخشع القلب!\nB) ساعِد أصدقاءک لیخرجوا من مشاکلهم بسهولة!\nC) یجب علی الإنسان کثیرٌ من المحاولات لیُصلح نفسه!\nD) ذهب صدیقی إلی متجر آخر لیشتری سروالا أرخص!",
        "metadata": {
            "image": false,
            "course": "arabic",
            "year": "1400",
            "month": "tir",
            "question_number": "22"
        }
    },
    "23": {
        "question": "عیّن «ما» شرطیّة:\n",
        "options": {
            "1": "ما تتعلّمه من العلوم المختلفة تُبعّدک عن الجهالة!",
            "2": "ما نبتت الأشجار الخانقة فی بلدنا لأنّها أشجار اِستوائیّة!",
            "3": "ما وجدتَ فی ذلک الکتاب الّذی أثّر فی نفسک بعد قرائته!",
            "4": "ما من صابر یصبر علی المشاکل إلّا و هو یحصل علی النّجاح!"
        },
        "final_answer": 1,
        "full_text": "عیّن «ما» شرطیّة:\n\nOptions:\nA) ما تتعلّمه من العلوم المختلفة تُبعّدک عن الجهالة!\nB) ما نبتت الأشجار الخانقة فی بلدنا لأنّها أشجار اِستوائیّة!\nC) ما وجدتَ فی ذلک الکتاب الّذی أثّر فی نفسک بعد قرائته!\nD) ما من صابر یصبر علی المشاکل إلّا و هو یحصل علی النّجاح!",
        "metadata": {
            "image": false,
            "course": "arabic",
            "year": "1400",
            "month": "tir",
            "question_number": "23"
        }
    },
    "24": {
        "question": "عیّن ما لیس فیه المفعول المطلق:\n",
        "options": {
            "1": "إن أکرمت الکریم إکراماً بالغاً تشاهد نتیجته!",
            "2": "أدّب المؤمن نفسه قبل تعلیم غیره تأدیباً جمیلاً!",
            "3": "کان عشّ بعض الطّیور بعیداً کثیراً عن المفترسین!",
            "4": "رغب المسافرون أن یسکنوا فی ذلک المکان رغبةٌ کثیرةٌ!"
        },
        "final_answer": 3,
        "full_text": "عیّن ما لیس فیه المفعول المطلق:\n\nOptions:\nA) إن أکرمت الکریم إکراماً بالغاً تشاهد نتیجته!\nB) أدّب المؤمن نفسه قبل تعلیم غیره تأدیباً جمیلاً!\nC) کان عشّ بعض الطّیور بعیداً کثیراً عن المفترسین!\nD) رغب المسافرون أن یسکنوا فی ذلک المکان رغبةٌ کثیرةٌ!",
        "metadata": {
            "image": false,
            "course": "arabic",
            "year": "1400",
            "month": "tir",
            "question_number": "24"
        }
    },
    "25": {
        "question": "عیّن ما فیه «نون الوقایة»:\n",
        "options": {
            "1": "إنّ البلبل یُغنّی حتّی إذا کان فی القفس!",
            "2": "سینفعنی غدًا کلُّ ما أتعلّم الیوم!",
            "3": "لا تَحزنی إنّ الله یساعدکِ فی هذه المسألة!",
            "4": "هذا الرّجل یبنی بیته فی حدیقة خارج المدینة!"
        },
        "final_answer": 2,
        "full_text": "عیّن ما فیه «نون الوقایة»:\n\nOptions:\nA) إنّ البلبل یُغنّی حتّی إذا کان فی القفس!\nB) سینفعنی غدًا کلُّ ما أتعلّم الیوم!\nC) لا تَحزنی إنّ الله یساعدکِ فی هذه المسألة!\nD) هذا الرّجل یبنی بیته فی حدیقة خارج المدینة!",
        "metadata": {
            "image": false,
            "course": "arabic",
            "year": "1400",
            "month": "tir",
            "question_number": "25"
        }
    }
}