{
    "1": {
        "question": "(إنّما ولیُّکم اللهُ و رسوله و الّذین آمنوا ....):\n",
        "options": {
            "1": "ولیّ شما فقط الله است و رسول او و کسانی که ایمان آورده‌اند ...",
            "2": "همانا ولی شما خداوند است و پیامبرش و هر کس ایمان بیاورد ...",
            "3": "سَرور شما بدون شک الله است و پیامبر و آنکه ایمان آورده است ...",
            "4": "بدرستی که خداوند سَرور شما است و رسول او و کسی که ایمان آورده است ..."
        },
        "final_answer": 1,
        "full_text": "(إنّما ولیُّکم اللهُ و رسوله و الّذین آمنوا ....):\n\nOptions:\nA) ولیّ شما فقط الله است و رسول او و کسانی که ایمان آورده‌اند ...\nB) همانا ولی شما خداوند است و پیامبرش و هر کس ایمان بیاورد ...\nC) سَرور شما بدون شک الله است و پیامبر و آنکه ایمان آورده است ...\nD) بدرستی که خداوند سَرور شما است و رسول او و کسی که ایمان آورده است ...",
        "metadata": {
            "image": false,
            "course": "arabic",
            "year": "1398",
            "month": "tir",
            "question_number": "1"
        }
    },
    "2": {
        "question": "«یَتراکم بخارُ الماء في السّماء و یتشکّل منه الغیمُ الّذي یُعدّ منشأ المطر!»:\n",
        "options": {
            "1": "بخار آب در آسمان متراکم می‌شود و از آن ابر تشکیل می‌گردد که منشأ باران بشمار می‌آید!",
            "2": "این بخارهای متراکم آسمان هستند که ابر را تشکیل می‌دهند و همان منشأ باران بشمار می‌آیند!",
            "3": "از بخارهای آبی که در آسمان متراکم شده است ابرها بوجود می‌آیند و آن یک منشأ برای باران است!",
            "4": "بخار آب در آسمان متراکم می‌شود و سبب بوجود آمدن ابرها در آسمان می‌گردد که منشأ باران است!"
        },
        "final_answer": 1,
        "full_text": "«یَتراکم بخارُ الماء في السّماء و یتشکّل منه الغیمُ الّذي یُعدّ منشأ المطر!»:\n\nOptions:\nA) بخار آب در آسمان متراکم می‌شود و از آن ابر تشکیل می‌گردد که منشأ باران بشمار می‌آید!\nB) این بخارهای متراکم آسمان هستند که ابر را تشکیل می‌دهند و همان منشأ باران بشمار می‌آیند!\nC) از بخارهای آبی که در آسمان متراکم شده است ابرها بوجود می‌آیند و آن یک منشأ برای باران است!\nD) بخار آب در آسمان متراکم می‌شود و سبب بوجود آمدن ابرها در آسمان می‌گردد که منشأ باران است!",
        "metadata": {
            "image": false,
            "course": "arabic",
            "year": "1398",
            "month": "tir",
            "question_number": "2"
        }
    },
    "3": {
        "question": "«إنّها من أعجب الأسماک، تغذیتُها صَعبة علی الهواة لِأنّها تُحبّ أن تأکل صیدَها حیًّا!»:\n",
        "options": {
            "1": "آن از ماهی‌های عجیبی است که تغذیه‌اش برای علاقه‌مندان سخت است برای اینکه دوست دارد شکارِ زنده بخورد!",
            "2": "او از شگفت‌ترین ماهیانی است که برای علاقمندان، غذا دادنش سخت است زیرا او خوردن زندهٔ شکار را دوست دارد!",
            "3": "او از ماهیان شگفت‌آوری است که برای علاقمندان، تغذیه‌اش سخت دشوار است زیرا زنده خوردنِ صید را دوست دارد!",
            "4": "آن از عجیب‌ترین ماهیهاست، غذا دادن به او برای علاقمندان دشوار است زیرا دوست دارد که صید خود را زنده بخورد!"
        },
        "final_answer": 4,
        "full_text": "«إنّها من أعجب الأسماک، تغذیتُها صَعبة علی الهواة لِأنّها تُحبّ أن تأکل صیدَها حیًّا!»:\n\nOptions:\nA) آن از ماهی‌های عجیبی است که تغذیه‌اش برای علاقه‌مندان سخت است برای اینکه دوست دارد شکارِ زنده بخورد!\nB) او از شگفت‌ترین ماهیانی است که برای علاقمندان، غذا دادنش سخت است زیرا او خوردن زندهٔ شکار را دوست دارد!\nC) او از ماهیان شگفت‌آوری است که برای علاقمندان، تغذیه‌اش سخت دشوار است زیرا زنده خوردنِ صید را دوست دارد!\nD) آن از عجیب‌ترین ماهیهاست، غذا دادن به او برای علاقمندان دشوار است زیرا دوست دارد که صید خود را زنده بخورد!",
        "metadata": {
            "image": false,
            "course": "arabic",
            "year": "1398",
            "month": "tir",
            "question_number": "3"
        }
    },
    "4": {
        "question": "«إنّ مِن أخلص النّاس مَن تَجري ینابیعُ الحکمة من قلبه علی لسانه!»:\n",
        "options": {
            "1": "از مردم با اخلاص‌تر کسی است که چشمه‌های حکمتی از قلب وی بر زبانش روانه شود!",
            "2": "کسی که چشمه‌های حکمت از قلب او بر زبانش جاری می‌شود، از خالص‌ترین مردم است!",
            "3": "از خالص‌ترین مردمان کسی است که چشمه‌های حکمت از قلب او بر زبان وی جاری شده باشد!",
            "4": "کسی‌که چشمه‌های حکمت را از قلب خویش بر زبان روانه سازد، از با اخلاص‌ترین مردمان است!"
        },
        "final_answer": 2,
        "full_text": "«إنّ مِن أخلص النّاس مَن تَجري ینابیعُ الحکمة من قلبه علی لسانه!»:\n\nOptions:\nA) از مردم با اخلاص‌تر کسی است که چشمه‌های حکمتی از قلب وی بر زبانش روانه شود!\nB) کسی که چشمه‌های حکمت از قلب او بر زبانش جاری می‌شود، از خالص‌ترین مردم است!\nC) از خالص‌ترین مردمان کسی است که چشمه‌های حکمت از قلب او بر زبان وی جاری شده باشد!\nD) کسی‌که چشمه‌های حکمت را از قلب خویش بر زبان روانه سازد، از با اخلاص‌ترین مردمان است!",
        "metadata": {
            "image": false,
            "course": "arabic",
            "year": "1398",
            "month": "tir",
            "question_number": "4"
        }
    },
    "5": {
        "question": "«لا تَستشر الکذّابَ، فإنّه کالسّراب یقرِّب علیک البعیدَ و یُبعد علیک القریبَ!»:\n",
        "options": {
            "1": "با شخص کذّاب مشورت مکن، زیرا او چون سراب است، دور را بر تو نزدیک می‌نمایاند و نزدیک را دور!",
            "2": "دروغزن را مورد مشورت خویش قرار نده، چه او همچون سراب بعید را به تو نزدیک می‌نمایاند و قریب را دور!",
            "3": "با شخص دروغگو مشورت نکن، چه او مانند سراب دور را به تو نزدیک می‌کند و نزدیک را از تو دور می‌سازد!",
            "4": "کذّاب را مشاور خود قرار مده، زیرا او مانند سراب است که بعید را به تو قریب می‌کند و قریب را از تو بعید می‌سازد!"
        },
        "final_answer": 1,
        "full_text": "«لا تَستشر الکذّابَ، فإنّه کالسّراب یقرِّب علیک البعیدَ و یُبعد علیک القریبَ!»:\n\nOptions:\nA) با شخص کذّاب مشورت مکن، زیرا او چون سراب است، دور را بر تو نزدیک می‌نمایاند و نزدیک را دور!\nB) دروغزن را مورد مشورت خویش قرار نده، چه او همچون سراب بعید را به تو نزدیک می‌نمایاند و قریب را دور!\nC) با شخص دروغگو مشورت نکن، چه او مانند سراب دور را به تو نزدیک می‌کند و نزدیک را از تو دور می‌سازد!\nD) کذّاب را مشاور خود قرار مده، زیرا او مانند سراب است که بعید را به تو قریب می‌کند و قریب را از تو بعید می‌سازد!",
        "metadata": {
            "image": false,
            "course": "arabic",
            "year": "1398",
            "month": "tir",
            "question_number": "5"
        }
    },
    "6": {
        "question": "«کنتُ اُفکِّر في نفسي هل یُمکن أن تکون قد خُلقت السّماءُ و الأرض و کلُّ ما فیهما من دون حکمة!»:\n",
        "options": {
            "1": "با خویش در اندیشه‌ام که آیا امکان دارد این آسمان و زمین و همه چیز که در آنهاست بی‌حکمت خلق شود!",
            "2": "با خودم فکر می‌کنم که آیا ممکن است، آسمان و زمین و هر چه در آن هست بی‌حکمت خلق شده باشد!",
            "3": "با خود می‌اندیشیدم، آیا امکان دارد که آسمان و زمین و هر آنچه در آنها است بدون حکمت خلق شده باشد!",
            "4": "با خویشتن خود فکر می‌کردم آیا ممکن است این آسمان و این زمین و آنچه که در آن هست بدون حکمت خلق شود!"
        },
        "final_answer": 3,
        "full_text": "«کنتُ اُفکِّر في نفسي هل یُمکن أن تکون قد خُلقت السّماءُ و الأرض و کلُّ ما فیهما من دون حکمة!»:\n\nOptions:\nA) با خویش در اندیشه‌ام که آیا امکان دارد این آسمان و زمین و همه چیز که در آنهاست بی‌حکمت خلق شود!\nB) با خودم فکر می‌کنم که آیا ممکن است، آسمان و زمین و هر چه در آن هست بی‌حکمت خلق شده باشد!\nC) با خود می‌اندیشیدم، آیا امکان دارد که آسمان و زمین و هر آنچه در آنها است بدون حکمت خلق شده باشد!\nD) با خویشتن خود فکر می‌کردم آیا ممکن است این آسمان و این زمین و آنچه که در آن هست بدون حکمت خلق شود!",
        "metadata": {
            "image": false,
            "course": "arabic",
            "year": "1398",
            "month": "tir",
            "question_number": "6"
        }
    },
    "7": {
        "question": "«هناک کلماتٌ تَجري علی أقلام بعض الشّعراء لأوّل مرّة تَدلّ علی مَفاهیم جدیدةٍ لَم یکن یَعرفها الآخرون!»:\n",
        "options": {
            "1": "کلماتی وجود دارند که برای بار اوّل بر قلمهای بعضی از شاعران جاری می‌شوند در حالی که بر مفهوم جدیدی که دیگران آن‌ها را نمی‌شناسند، دلالت دارد!",
            "2": "وجود دارد کلماتی که بعضی از شعرا برای اوّلین مرتبه بر قلمهای خود جاری می‌کنند که بر مفاهیمی جدید دلالت می‌کند که آن را دیگران نمی‌شناختند!",
            "3": "آنجا، کلماتی است که بعضی شاعران اوّلین مرتبه، بر قلمهایشان جاری می‌کنند و بر مفهوم جدید که دیگران آن‌ها را نمی‌شناخته‌اند دلالت دارد!",
            "4": "کلماتی هستند که بر قلمهای بعضی شعرا برای اوّلین بار جاری می‌شوند که بر مفاهیم جدیدی دلالت می‌کنند که دیگران، آن‌ها را نمی‌شناختند!"
        },
        "final_answer": 4,
        "full_text": "«هناک کلماتٌ تَجري علی أقلام بعض الشّعراء لأوّل مرّة تَدلّ علی مَفاهیم جدیدةٍ لَم یکن یَعرفها الآخرون!»:\n\nOptions:\nA) کلماتی وجود دارند که برای بار اوّل بر قلمهای بعضی از شاعران جاری می‌شوند در حالی که بر مفهوم جدیدی که دیگران آن‌ها را نمی‌شناسند، دلالت دارد!\nB) وجود دارد کلماتی که بعضی از شعرا برای اوّلین مرتبه بر قلمهای خود جاری می‌کنند که بر مفاهیمی جدید دلالت می‌کند که آن را دیگران نمی‌شناختند!\nC) آنجا، کلماتی است که بعضی شاعران اوّلین مرتبه، بر قلمهایشان جاری می‌کنند و بر مفهوم جدید که دیگران آن‌ها را نمی‌شناخته‌اند دلالت دارد!\nD) کلماتی هستند که بر قلمهای بعضی شعرا برای اوّلین بار جاری می‌شوند که بر مفاهیم جدیدی دلالت می‌کنند که دیگران، آن‌ها را نمی‌شناختند!",
        "metadata": {
            "image": false,
            "course": "arabic",
            "year": "1398",
            "month": "tir",
            "question_number": "7"
        }
    },
    "8": {
        "question": "عیّن الصّحیح:\n",
        "options": {
            "1": "لیتني رأیت جمیع الکتب: کاش همهٔ کتابها را ببینم!",
            "2": "لعلّ الخیر قد نزل علینا: شاید خیر بر ما نازل شود!",
            "3": "لیت الاِمتحان قد انتهی: کاش امتحان تمام شود!",
            "4": "لعلّ الصّبر یُنقذنا: شاید پایداری نجاتمان دهد!"
        },
        "final_answer": 4,
        "full_text": "عیّن الصّحیح:\n\nOptions:\nA) لیتني رأیت جمیع الکتب: کاش همهٔ کتابها را ببینم!\nB) لعلّ الخیر قد نزل علینا: شاید خیر بر ما نازل شود!\nC) لیت الاِمتحان قد انتهی: کاش امتحان تمام شود!\nD) لعلّ الصّبر یُنقذنا: شاید پایداری نجاتمان دهد!",
        "metadata": {
            "image": false,
            "course": "arabic",
            "year": "1398",
            "month": "tir",
            "question_number": "8"
        }
    },
    "9": {
        "question": "عیّن الصّحیح:\n",
        "options": {
            "1": "إنّما مَن لَم یلد و لم یولد، هو الله: کسی که نزاده و زاده نشده، فقط الله است!",
            "2": "جاءَت الاُمُّ بالحبوب لفراخها الصّغیرة: مادر با دانه‌ها نزد جوجه‌های کوچک آمد!",
            "3": "یُنفقون مِن أحسن ما یُحبّون أکثر من قبل: با کمال میل از نیکوترین چیزی که دوست می‌دارند، انفاق می‌کنند!",
            "4": "عند ما یُلقي الخطیبُ محاضرةً یُنصت الحضّارُ له: وقتی سخنران سخنرانی می‌کرد حاضران با سکوت به او گوش می‌کردند!"
        },
        "final_answer": 1,
        "full_text": "عیّن الصّحیح:\n\nOptions:\nA) إنّما مَن لَم یلد و لم یولد، هو الله: کسی که نزاده و زاده نشده، فقط الله است!\nB) جاءَت الاُمُّ بالحبوب لفراخها الصّغیرة: مادر با دانه‌ها نزد جوجه‌های کوچک آمد!\nC) یُنفقون مِن أحسن ما یُحبّون أکثر من قبل: با کمال میل از نیکوترین چیزی که دوست می‌دارند، انفاق می‌کنند!\nD) عند ما یُلقي الخطیبُ محاضرةً یُنصت الحضّارُ له: وقتی سخنران سخنرانی می‌کرد حاضران با سکوت به او گوش می‌کردند!",
        "metadata": {
            "image": false,
            "course": "arabic",
            "year": "1398",
            "month": "tir",
            "question_number": "9"
        }
    },
    "10": {
        "question": "«خفّاش تنها حیوان پستانداری است که قادر به پرواز می‌باشد!»:\n",
        "options": {
            "1": "الخفّاش الّذي حیوان لبون وحید و هو قادر علی الطّیران!",
            "2": "الحیوان الوحید اللّبون لا یقدر علی الطّیران هو الخفّاش!",
            "3": "الخفّاش هو الحیوان اللّبون الوحید الّذي یَقدر علی الطّیران!",
            "4": "الحیوان اللّبون الوحید و هو قادر علی الطّیران لیس الخفّاش!"
        },
        "final_answer": 3,
        "full_text": "«خفّاش تنها حیوان پستانداری است که قادر به پرواز می‌باشد!»:\n\nOptions:\nA) الخفّاش الّذي حیوان لبون وحید و هو قادر علی الطّیران!\nB) الحیوان الوحید اللّبون لا یقدر علی الطّیران هو الخفّاش!\nC) الخفّاش هو الحیوان اللّبون الوحید الّذي یَقدر علی الطّیران!\nD) الحیوان اللّبون الوحید و هو قادر علی الطّیران لیس الخفّاش!",
        "metadata": {
            "image": false,
            "course": "arabic",
            "year": "1398",
            "month": "tir",
            "question_number": "10"
        }
    },
    "11": {
        "question": "اِقرأ النّص التّالي ثمّ أجب عن الأسئلة (و ۶ سوال بعدی) بما یناسب النصّ:\nحینما نذهب إلی المناطق الحارّة قد نشاهد مناظر جذّابة من بعید، و بعد أن نقترب منها، نری أشجار النّخل الجمیلة. کما أنّ لهذه الشّجرة أهمیّة مادیّة کبیرة، حیث یُشکِّل نوع منها في بعض المناطق أساسًا لمعیشة الکثیر من السّکان، کما أنّه غذاء رئیسيّ في بعض المناطق الصحراویّة، و بعض أثمارها تُجفَّف و تُرسَل إلی مناطق اُخری!\nللنّجل أنواع مختلفة، حیث یُوجَد حوالي ۱۵۰۰ نوع یختلف مع بعضها؛ فمن أنواعه نخیل التّمر الّذي یُعتبر (= یُعدّ) من أهمَها، و نخیل الزّیت الّذي یُستعمل في صنع الصّابون و موادّ التجمیل!\nیبلغ ارتفاع النّخل ۲۷ مترًا و جذعه خشن جدًّا، لأنّه عبارة عن بقایا غصن النخل الّذي یسقط أو یُقطَع عند نموّ الشجرة الکثیر!\nعیّن الصّحیح:\n",
        "options": {
            "1": "یُجفَّف التّمر في المناطق الّتي یُرسل إلیها!",
            "2": "نری النّخل جذّابًا من البعید و من القریب!",
            "3": "إن کان التّمر أساسًا للمعیشة لا یُرسل إلی المناطق الاُخری!",
            "4": "بعض ساکني المناطق الصحراویّة لا یستطیعون أن یأکللوا إلّا التّمر!"
        },
        "final_answer": 2,
        "full_text": "اِقرأ النّص التّالي ثمّ أجب عن الأسئلة (و ۶ سوال بعدی) بما یناسب النصّ:\nحینما نذهب إلی المناطق الحارّة قد نشاهد مناظر جذّابة من بعید، و بعد أن نقترب منها، نری أشجار النّخل الجمیلة. کما أنّ لهذه الشّجرة أهمیّة مادیّة کبیرة، حیث یُشکِّل نوع منها في بعض المناطق أساسًا لمعیشة الکثیر من السّکان، کما أنّه غذاء رئیسيّ في بعض المناطق الصحراویّة، و بعض أثمارها تُجفَّف و تُرسَل إلی مناطق اُخری!\nللنّجل أنواع مختلفة، حیث یُوجَد حوالي ۱۵۰۰ نوع یختلف مع بعضها؛ فمن أنواعه نخیل التّمر الّذي یُعتبر (= یُعدّ) من أهمَها، و نخیل الزّیت الّذي یُستعمل في صنع الصّابون و موادّ التجمیل!\nیبلغ ارتفاع النّخل ۲۷ مترًا و جذعه خشن جدًّا، لأنّه عبارة عن بقایا غصن النخل الّذي یسقط أو یُقطَع عند نموّ الشجرة الکثیر!\nعیّن الصّحیح:\n\nOptions:\nA) یُجفَّف التّمر في المناطق الّتي یُرسل إلیها!\nB) نری النّخل جذّابًا من البعید و من القریب!\nC) إن کان التّمر أساسًا للمعیشة لا یُرسل إلی المناطق الاُخری!\nD) بعض ساکني المناطق الصحراویّة لا یستطیعون أن یأکللوا إلّا التّمر!",
        "metadata": {
            "image": false,
            "course": "arabic",
            "year": "1398",
            "month": "tir",
            "question_number": "11"
        }
    },
    "12": {
        "question": "عیّن الصحیح عن شجرة النخل:\n",
        "options": {
            "1": "یبلغ ارتفاعها إلی سبعة و عشرین مترًا لکن غصونها أکثر طولًا و خشونةً!",
            "2": "أنواعه متعدّدة تصل إلی ألف و خمسمائة ولکن أثمارها من نوع واحد!",
            "3": "لا منطقة في الأرض إلّا و فیها التّمر یُعرف کمادّة غذائیّة!",
            "4": "أهمّ أنواعها نخیل التّمر و نخیل الزّیت!"
        },
        "final_answer": 4,
        "full_text": "اِقرأ النّص التّالي ثمّ أجب عن الأسئلة (و ۶ سوال بعدی) بما یناسب النصّ:\nحینما نذهب إلی المناطق الحارّة قد نشاهد مناظر جذّابة من بعید، و بعد أن نقترب منها، نری أشجار النّخل الجمیلة. کما أنّ لهذه الشّجرة أهمیّة مادیّة کبیرة، حیث یُشکِّل نوع منها في بعض المناطق أساسًا لمعیشة الکثیر من السّکان، کما أنّه غذاء رئیسيّ في بعض المناطق الصحراویّة، و بعض أثمارها تُجفَّف و تُرسَل إلی مناطق اُخری!\nللنّجل أنواع مختلفة، حیث یُوجَد حوالي ۱۵۰۰ نوع یختلف مع بعضها؛ فمن أنواعه نخیل التّمر الّذي یُعتبر (= یُعدّ) من أهمَها، و نخیل الزّیت الّذي یُستعمل في صنع الصّابون و موادّ التجمیل!\nیبلغ ارتفاع النّخل ۲۷ مترًا و جذعه خشن جدًّا، لأنّه عبارة عن بقایا غصن النخل الّذي یسقط أو یُقطَع عند نموّ الشجرة الکثیر!\nعیّن الصحیح عن شجرة النخل:\n\nOptions:\nA) یبلغ ارتفاعها إلی سبعة و عشرین مترًا لکن غصونها أکثر طولًا و خشونةً!\nB) أنواعه متعدّدة تصل إلی ألف و خمسمائة ولکن أثمارها من نوع واحد!\nC) لا منطقة في الأرض إلّا و فیها التّمر یُعرف کمادّة غذائیّة!\nD) أهمّ أنواعها نخیل التّمر و نخیل الزّیت!",
        "metadata": {
            "image": false,
            "course": "arabic",
            "year": "1398",
            "month": "tir",
            "question_number": "12"
        }
    },
    "13": {
        "question": "عیّن الخطأ: من فوائد النّخل أنّه ....\n",
        "options": {
            "1": "مناظره رائعة جدًّا في المناطق الحارّة الّتي لا نری فیها أشجارًا خضراء!",
            "2": "مادّة غذائیّة مفیدة ینمو في المناطق الباردة و تعتبر ثمرته غذاءً رئیسیًّا!",
            "3": "تُصنع من ثمرته موادّ تستعمل في زینة و تجمیل النّاس!",
            "4": "تُستخدم ثمرته في الموادّ الّتي نحن بحاجة إلیها للنّظافة!"
        },
        "final_answer": 2,
        "full_text": "اِقرأ النّص التّالي ثمّ أجب عن الأسئلة (و ۶ سوال بعدی) بما یناسب النصّ:\nحینما نذهب إلی المناطق الحارّة قد نشاهد مناظر جذّابة من بعید، و بعد أن نقترب منها، نری أشجار النّخل الجمیلة. کما أنّ لهذه الشّجرة أهمیّة مادیّة کبیرة، حیث یُشکِّل نوع منها في بعض المناطق أساسًا لمعیشة الکثیر من السّکان، کما أنّه غذاء رئیسيّ في بعض المناطق الصحراویّة، و بعض أثمارها تُجفَّف و تُرسَل إلی مناطق اُخری!\nللنّجل أنواع مختلفة، حیث یُوجَد حوالي ۱۵۰۰ نوع یختلف مع بعضها؛ فمن أنواعه نخیل التّمر الّذي یُعتبر (= یُعدّ) من أهمَها، و نخیل الزّیت الّذي یُستعمل في صنع الصّابون و موادّ التجمیل!\nیبلغ ارتفاع النّخل ۲۷ مترًا و جذعه خشن جدًّا، لأنّه عبارة عن بقایا غصن النخل الّذي یسقط أو یُقطَع عند نموّ الشجرة الکثیر!\nعیّن الخطأ: من فوائد النّخل أنّه ....\n\nOptions:\nA) مناظره رائعة جدًّا في المناطق الحارّة الّتي لا نری فیها أشجارًا خضراء!\nB) مادّة غذائیّة مفیدة ینمو في المناطق الباردة و تعتبر ثمرته غذاءً رئیسیًّا!\nC) تُصنع من ثمرته موادّ تستعمل في زینة و تجمیل النّاس!\nD) تُستخدم ثمرته في الموادّ الّتي نحن بحاجة إلیها للنّظافة!",
        "metadata": {
            "image": false,
            "course": "arabic",
            "year": "1398",
            "month": "tir",
            "question_number": "13"
        }
    },
    "14": {
        "question": "عیّن الخطأ: جذع النّخل خشن جدًّا لأنّه ....\n",
        "options": {
            "1": "یفرق رأس الغصن و انتهاؤه فیُقطع رأسه فقط!",
            "2": "عندما یجفّ الغصن لایسقط من الجذع إلّا رأسه!",
            "3": "یَقطع الفلّاحون الغصن القدیم بعض الأحیان و یبقی أثره!",
            "4": "النّخل هکذا في خلقته و هو ما بقي من جذوعٍ تسقط!"
        },
        "final_answer": 4,
        "full_text": "اِقرأ النّص التّالي ثمّ أجب عن الأسئلة (و ۶ سوال بعدی) بما یناسب النصّ:\nحینما نذهب إلی المناطق الحارّة قد نشاهد مناظر جذّابة من بعید، و بعد أن نقترب منها، نری أشجار النّخل الجمیلة. کما أنّ لهذه الشّجرة أهمیّة مادیّة کبیرة، حیث یُشکِّل نوع منها في بعض المناطق أساسًا لمعیشة الکثیر من السّکان، کما أنّه غذاء رئیسيّ في بعض المناطق الصحراویّة، و بعض أثمارها تُجفَّف و تُرسَل إلی مناطق اُخری!\nللنّجل أنواع مختلفة، حیث یُوجَد حوالي ۱۵۰۰ نوع یختلف مع بعضها؛ فمن أنواعه نخیل التّمر الّذي یُعتبر (= یُعدّ) من أهمَها، و نخیل الزّیت الّذي یُستعمل في صنع الصّابون و موادّ التجمیل!\nیبلغ ارتفاع النّخل ۲۷ مترًا و جذعه خشن جدًّا، لأنّه عبارة عن بقایا غصن النخل الّذي یسقط أو یُقطَع عند نموّ الشجرة الکثیر!\nعیّن الخطأ: جذع النّخل خشن جدًّا لأنّه ....\n\nOptions:\nA) یفرق رأس الغصن و انتهاؤه فیُقطع رأسه فقط!\nB) عندما یجفّ الغصن لایسقط من الجذع إلّا رأسه!\nC) یَقطع الفلّاحون الغصن القدیم بعض الأحیان و یبقی أثره!\nD) النّخل هکذا في خلقته و هو ما بقي من جذوعٍ تسقط!",
        "metadata": {
            "image": false,
            "course": "arabic",
            "year": "1398",
            "month": "tir",
            "question_number": "14"
        }
    },
    "15": {
        "question": "عیّن الصحیح في الإعراب و التحلیل الصرفي«نُشاهد»:\n",
        "options": {
            "1": "مزید ثلاثي (حروفه الأصلیة: ن ش هـ) - معلوم / مع فاعله جملةٌ فعلیةٌ",
            "2": "مضارع - للمتکلّم مع الغیر - مزید ثلاثي / فعل و مع فاعله جملةٌ فعلیّة",
            "3": "فعل مضارع - مزید ثلاثي (من وزن «فاعَل») - مجهول / فعلٌ و مفعوله «مناظر»",
            "4": "للمتکلّم وحده - مزید ثلاثي (مصدره: مشاهدة، من وزن مفاعلة) / مع فاعله جملةٌ فعلیّة"
        },
        "final_answer": 2,
        "full_text": "اِقرأ النّص التّالي ثمّ أجب عن الأسئلة (و ۶ سوال بعدی) بما یناسب النصّ:\nحینما نذهب إلی المناطق الحارّة قد نشاهد مناظر جذّابة من بعید، و بعد أن نقترب منها، نری أشجار النّخل الجمیلة. کما أنّ لهذه الشّجرة أهمیّة مادیّة کبیرة، حیث یُشکِّل نوع منها في بعض المناطق أساسًا لمعیشة الکثیر من السّکان، کما أنّه غذاء رئیسيّ في بعض المناطق الصحراویّة، و بعض أثمارها تُجفَّف و تُرسَل إلی مناطق اُخری!\nللنّجل أنواع مختلفة، حیث یُوجَد حوالي ۱۵۰۰ نوع یختلف مع بعضها؛ فمن أنواعه نخیل التّمر الّذي یُعتبر (= یُعدّ) من أهمَها، و نخیل الزّیت الّذي یُستعمل في صنع الصّابون و موادّ التجمیل!\nیبلغ ارتفاع النّخل ۲۷ مترًا و جذعه خشن جدًّا، لأنّه عبارة عن بقایا غصن النخل الّذي یسقط أو یُقطَع عند نموّ الشجرة الکثیر!\nعیّن الصحیح في الإعراب و التحلیل الصرفي«نُشاهد»:\n\nOptions:\nA) مزید ثلاثي (حروفه الأصلیة: ن ش هـ) - معلوم / مع فاعله جملةٌ فعلیةٌ\nB) مضارع - للمتکلّم مع الغیر - مزید ثلاثي / فعل و مع فاعله جملةٌ فعلیّة\nC) فعل مضارع - مزید ثلاثي (من وزن «فاعَل») - مجهول / فعلٌ و مفعوله «مناظر»\nD) للمتکلّم وحده - مزید ثلاثي (مصدره: مشاهدة، من وزن مفاعلة) / مع فاعله جملةٌ فعلیّة",
        "metadata": {
            "image": false,
            "course": "arabic",
            "year": "1398",
            "month": "tir",
            "question_number": "15"
        }
    },
    "16": {
        "question": "عیّن الصحیح في الإعراب و التحلیل الصرفي «تُرسَل»:\n",
        "options": {
            "1": "فعل مضارع - للغائبة - معلوم / فعلٌ و جملته فعلیةٌ",
            "2": "للمخاطب - مزید ثلاثي (مصدره علی وزن إفعال) / فعل و مع فاعله جملةٌ فعلیّةٌ",
            "3": "للغائبة - مزید ثلاثي (ماضیه: «أرسل» علی وزن أفعل) - مجهول / فعل و الجملة فعلیّةٌ",
            "4": "مضارع - للمخاطب - مزید ثلاثي (حروفه الأصلیة: ر س ل) - مجهول / فعل و فاعله محذوف، و الجملة فعلیّةٌ"
        },
        "final_answer": 3,
        "full_text": "اِقرأ النّص التّالي ثمّ أجب عن الأسئلة (و ۶ سوال بعدی) بما یناسب النصّ:\nحینما نذهب إلی المناطق الحارّة قد نشاهد مناظر جذّابة من بعید، و بعد أن نقترب منها، نری أشجار النّخل الجمیلة. کما أنّ لهذه الشّجرة أهمیّة مادیّة کبیرة، حیث یُشکِّل نوع منها في بعض المناطق أساسًا لمعیشة الکثیر من السّکان، کما أنّه غذاء رئیسيّ في بعض المناطق الصحراویّة، و بعض أثمارها تُجفَّف و تُرسَل إلی مناطق اُخری!\nللنّجل أنواع مختلفة، حیث یُوجَد حوالي ۱۵۰۰ نوع یختلف مع بعضها؛ فمن أنواعه نخیل التّمر الّذي یُعتبر (= یُعدّ) من أهمَها، و نخیل الزّیت الّذي یُستعمل في صنع الصّابون و موادّ التجمیل!\nیبلغ ارتفاع النّخل ۲۷ مترًا و جذعه خشن جدًّا، لأنّه عبارة عن بقایا غصن النخل الّذي یسقط أو یُقطَع عند نموّ الشجرة الکثیر!\nعیّن الصحیح في الإعراب و التحلیل الصرفي «تُرسَل»:\n\nOptions:\nA) فعل مضارع - للغائبة - معلوم / فعلٌ و جملته فعلیةٌ\nB) للمخاطب - مزید ثلاثي (مصدره علی وزن إفعال) / فعل و مع فاعله جملةٌ فعلیّةٌ\nC) للغائبة - مزید ثلاثي (ماضیه: «أرسل» علی وزن أفعل) - مجهول / فعل و الجملة فعلیّةٌ\nD) مضارع - للمخاطب - مزید ثلاثي (حروفه الأصلیة: ر س ل) - مجهول / فعل و فاعله محذوف، و الجملة فعلیّةٌ",
        "metadata": {
            "image": false,
            "course": "arabic",
            "year": "1398",
            "month": "tir",
            "question_number": "16"
        }
    },
    "17": {
        "question": "عیّن الصحیح في الإعراب و التحلیل الصرفي «ارتفاع»:\n",
        "options": {
            "1": "مفرد مذکّر - مصدر (من وزن انفعال) / فاعل لفعل «یبلغ»",
            "2": "اسم - مفرد مذکّر - مصدر (من وزن افتعال) / فاعل لفعل «یبلغ»",
            "3": "مفرد مذکّر - فعله «ارتفع» علی وزن «انفعل» / مضاف، و المضاف إلیه «النخل»",
            "4": "اسم - جمع مکسّر أو تکسیر - حروفه الأصلیة «ر ف ع» / مضاف و المضاف إلیه «النخل»"
        },
        "final_answer": 2,
        "full_text": "اِقرأ النّص التّالي ثمّ أجب عن الأسئلة (و ۶ سوال بعدی) بما یناسب النصّ:\nحینما نذهب إلی المناطق الحارّة قد نشاهد مناظر جذّابة من بعید، و بعد أن نقترب منها، نری أشجار النّخل الجمیلة. کما أنّ لهذه الشّجرة أهمیّة مادیّة کبیرة، حیث یُشکِّل نوع منها في بعض المناطق أساسًا لمعیشة الکثیر من السّکان، کما أنّه غذاء رئیسيّ في بعض المناطق الصحراویّة، و بعض أثمارها تُجفَّف و تُرسَل إلی مناطق اُخری!\nللنّجل أنواع مختلفة، حیث یُوجَد حوالي ۱۵۰۰ نوع یختلف مع بعضها؛ فمن أنواعه نخیل التّمر الّذي یُعتبر (= یُعدّ) من أهمَها، و نخیل الزّیت الّذي یُستعمل في صنع الصّابون و موادّ التجمیل!\nیبلغ ارتفاع النّخل ۲۷ مترًا و جذعه خشن جدًّا، لأنّه عبارة عن بقایا غصن النخل الّذي یسقط أو یُقطَع عند نموّ الشجرة الکثیر!\nعیّن الصحیح في الإعراب و التحلیل الصرفي «ارتفاع»:\n\nOptions:\nA) مفرد مذکّر - مصدر (من وزن انفعال) / فاعل لفعل «یبلغ»\nB) اسم - مفرد مذکّر - مصدر (من وزن افتعال) / فاعل لفعل «یبلغ»\nC) مفرد مذکّر - فعله «ارتفع» علی وزن «انفعل» / مضاف، و المضاف إلیه «النخل»\nD) اسم - جمع مکسّر أو تکسیر - حروفه الأصلیة «ر ف ع» / مضاف و المضاف إلیه «النخل»",
        "metadata": {
            "image": false,
            "course": "arabic",
            "year": "1398",
            "month": "tir",
            "question_number": "17"
        }
    },
    "18": {
        "question": "عیّن الخطأ في ضبط حرکات الکلمات:\n",
        "options": {
            "1": "عَلَیکُم بِمکارِمِ الأخلاقِ فإنَّ رَبّي بَعَثني بِها!",
            "2": "اللّهُمَّ انفَعْني بِما عَلَّمتَني و عَلِّمْني ما یَنفَعُني!",
            "3": "کُنْ صادِقًا مَعَ نَفسِکَ و مَعَ الآخَرینَ في الحیاةِ!",
            "4": "اِتَّصَلَ بِصَدیقهِ مُصَلَّح السَّیاراتِ لکي یُصلَّحَ سَیّارتَهُم!"
        },
        "final_answer": 4,
        "full_text": "عیّن الخطأ في ضبط حرکات الکلمات:\n\nOptions:\nA) عَلَیکُم بِمکارِمِ الأخلاقِ فإنَّ رَبّي بَعَثني بِها!\nB) اللّهُمَّ انفَعْني بِما عَلَّمتَني و عَلِّمْني ما یَنفَعُني!\nC) کُنْ صادِقًا مَعَ نَفسِکَ و مَعَ الآخَرینَ في الحیاةِ!\nD) اِتَّصَلَ بِصَدیقهِ مُصَلَّح السَّیاراتِ لکي یُصلَّحَ سَیّارتَهُم!",
        "metadata": {
            "image": false,
            "course": "arabic",
            "year": "1398",
            "month": "tir",
            "question_number": "18"
        }
    },
    "19": {
        "question": "عیّن الصحیح للتوضیحات التالیة:\n",
        "options": {
            "1": "إن لم تُمطر السّماء فنُواجه ... = (الجافَّ)",
            "2": "مکانُ جَعلِ الأقدام هو ... = (الوطأة)",
            "3": "... هو الجزء الّذي نأکله من الفاکهة = (النّوی)",
            "4": "... یقف في الشّارع لرعایة المرور = (الشرطة)"
        },
        "final_answer": 2,
        "full_text": "عیّن الصحیح للتوضیحات التالیة:\n\nOptions:\nA) إن لم تُمطر السّماء فنُواجه ... = (الجافَّ)\nB) مکانُ جَعلِ الأقدام هو ... = (الوطأة)\nC) ... هو الجزء الّذي نأکله من الفاکهة = (النّوی)\nD) ... یقف في الشّارع لرعایة المرور = (الشرطة)",
        "metadata": {
            "image": false,
            "course": "arabic",
            "year": "1398",
            "month": "tir",
            "question_number": "19"
        }
    },
    "20": {
        "question": "عیّن نوع الجمع یختلف عن الباقي:\n",
        "options": {
            "1": "رأیت هؤلاء المؤمنین في المسجد!",
            "2": "علینا أن نرحم المساکین!",
            "3": "شاهدت الطّلاب جالسین في الصفّ!",
            "4": "اتّحاد المسلمین یسبّب تقدّمهم!"
        },
        "final_answer": 2,
        "full_text": "عیّن نوع الجمع یختلف عن الباقي:\n\nOptions:\nA) رأیت هؤلاء المؤمنین في المسجد!\nB) علینا أن نرحم المساکین!\nC) شاهدت الطّلاب جالسین في الصفّ!\nD) اتّحاد المسلمین یسبّب تقدّمهم!",
        "metadata": {
            "image": false,
            "course": "arabic",
            "year": "1398",
            "month": "tir",
            "question_number": "20"
        }
    },
    "21": {
        "question": "عیّن ما لیس فیه اسم التفضیل:\n",
        "options": {
            "1": "أتقی النّاسِ من لا یخاف النّاسُ من لسانه!",
            "2": "کان مِن بین أصدقائي مَن هو أنجح التلامیذ!",
            "3": "أعلم أنّ مَن جَمع علمَ النّاس إلی علمه فهو علیمٌ!",
            "4": "إنّ اللّون الأبیض أحسن لونٍ لألبسة الممرّضات!"
        },
        "final_answer": 3,
        "full_text": "عیّن ما لیس فیه اسم التفضیل:\n\nOptions:\nA) أتقی النّاسِ من لا یخاف النّاسُ من لسانه!\nB) کان مِن بین أصدقائي مَن هو أنجح التلامیذ!\nC) أعلم أنّ مَن جَمع علمَ النّاس إلی علمه فهو علیمٌ!\nD) إنّ اللّون الأبیض أحسن لونٍ لألبسة الممرّضات!",
        "metadata": {
            "image": false,
            "course": "arabic",
            "year": "1398",
            "month": "tir",
            "question_number": "21"
        }
    },
    "22": {
        "question": "عیّن مضارعًا لیس معادلًا للالتزامی الفارسی:\n",
        "options": {
            "1": "اُمرنا بأن لا نغضبُ ، ولکنّنا نغضبُ، و هذا الأمر شائع بیننا!",
            "2": "لعلّ الإنسان یعرف الحضارات مِن خلال الکتابات و التماثیل!",
            "3": "کأنّ هذا الجبل أعلی من بقیّة الجبال، لیتنی أصعد إلی رأسه!",
            "4": "لینتا نقرأ آراء عدّة کُتّاب حول هذا الموضوع لنأخذ نتیجة صحیحة!"
        },
        "final_answer": 1,
        "full_text": "عیّن مضارعًا لیس معادلًا للالتزامی الفارسی:\n\nOptions:\nA) اُمرنا بأن لا نغضبُ ، ولکنّنا نغضبُ، و هذا الأمر شائع بیننا!\nB) لعلّ الإنسان یعرف الحضارات مِن خلال الکتابات و التماثیل!\nC) کأنّ هذا الجبل أعلی من بقیّة الجبال، لیتنی أصعد إلی رأسه!\nD) لینتا نقرأ آراء عدّة کُتّاب حول هذا الموضوع لنأخذ نتیجة صحیحة!",
        "metadata": {
            "image": false,
            "course": "arabic",
            "year": "1398",
            "month": "tir",
            "question_number": "22"
        }
    },
    "23": {
        "question": "عیّن الصحیح عن «لا» النافیة للجنس:\n",
        "options": {
            "1": "لا حیاءٌ و عفافٌ و أدبٌ إلّا لعقلٍ ثابت!",
            "2": "لا العزّة إلّا لربّنا الرحیم الّذي له کلّ شيء!",
            "3": "لا أتذکّر زمانَ ذهابنا إلی تلک الجولة العلمیّة!",
            "4": "لا شعبَ من شعوب العالم إلّا و له طریقةٌ للعبادة!"
        },
        "final_answer": 4,
        "full_text": "عیّن الصحیح عن «لا» النافیة للجنس:\n\nOptions:\nA) لا حیاءٌ و عفافٌ و أدبٌ إلّا لعقلٍ ثابت!\nB) لا العزّة إلّا لربّنا الرحیم الّذي له کلّ شيء!\nC) لا أتذکّر زمانَ ذهابنا إلی تلک الجولة العلمیّة!\nD) لا شعبَ من شعوب العالم إلّا و له طریقةٌ للعبادة!",
        "metadata": {
            "image": false,
            "course": "arabic",
            "year": "1398",
            "month": "tir",
            "question_number": "23"
        }
    },
    "24": {
        "question": "عیّن المصدر لا یُبیّن نوع الفعل:\n",
        "options": {
            "1": "یا أصدقاء أوفوا بعهدکم وفاء جمیلًا!",
            "2": "شجّعنا أصدقاءَنا في المسابقة تشجیعًا کثیرًا!",
            "3": "إن کنت تلمیذًا عاقلًا فلا تُضیّع أوقاتک تضییعًا!",
            "4": "إنّ العطّار یشمّ رائحة المسک شمًّا دقیقًا و یعرفه!"
        },
        "final_answer": 3,
        "full_text": "عیّن المصدر لا یُبیّن نوع الفعل:\n\nOptions:\nA) یا أصدقاء أوفوا بعهدکم وفاء جمیلًا!\nB) شجّعنا أصدقاءَنا في المسابقة تشجیعًا کثیرًا!\nC) إن کنت تلمیذًا عاقلًا فلا تُضیّع أوقاتک تضییعًا!\nD) إنّ العطّار یشمّ رائحة المسک شمًّا دقیقًا و یعرفه!",
        "metadata": {
            "image": false,
            "course": "arabic",
            "year": "1398",
            "month": "tir",
            "question_number": "24"
        }
    },
    "25": {
        "question": "عیّن ما فیه الحال:\n",
        "options": {
            "1": "جاء لنا مدعوّون کثیرون هم تَناولوا الطّعام في ساعة متأخّرة!",
            "2": "جاء ضیوف کثیرون و جاء صاحبُ البیت و استقبلهم بحفاوة!",
            "3": "جاء الضّیوف الکثیرون و هم یتکلّمون عن ذکریات الضّیافة!",
            "4": "جاء لنا المدعوّون الکثیرون حین کُنّا نتکلّم مع أصدقائنا!"
        },
        "final_answer": 3,
        "full_text": "عیّن ما فیه الحال:\n\nOptions:\nA) جاء لنا مدعوّون کثیرون هم تَناولوا الطّعام في ساعة متأخّرة!\nB) جاء ضیوف کثیرون و جاء صاحبُ البیت و استقبلهم بحفاوة!\nC) جاء الضّیوف الکثیرون و هم یتکلّمون عن ذکریات الضّیافة!\nD) جاء لنا المدعوّون الکثیرون حین کُنّا نتکلّم مع أصدقائنا!",
        "metadata": {
            "image": false,
            "course": "arabic",
            "year": "1398",
            "month": "tir",
            "question_number": "25"
        }
    }
}